,title,year,text,rating,providers
381,The Menu,2022,"Una giovane coppia si reca per un viaggio di piacere in un'isola remota, dove tra le altre cose ha programmato di mangiare in un ristorante esclusivo. Lo chef infatti è solito preparare menu strabilianti e soprattutto ricchi di sorprese.",,[]
382,Essere John Malkovich,1999,"Craig Schwartz, aspirante burattinaio, viene assunto come archivista alla LesterCorp, uno strano ufficio dove una porticina, nascosta dietro uno schedario, è in realtà un passaggio segreto che consente di entrare per 15 minuti nella testa del famoso attore John Malkovich.",7.6,['Amazon Prime Video']
383,History of the Main Complaint,1996,"History of the Main Complaint is the sixth film [of a] series and is based on twenty-one drawings. It was made shortly after the establishment in South Africa of the Truth and Reconciliation Commission, headed by Archbishop Desmond Tutu. It was set up to conduct a series of public hearings into abuses of human rights perpetrated during the apartheid era. The hearings, in which individuals told their stories of personal suffering, were held in order to make reparation for abuse and in the hope of creating reconciliation between peoples. The underlying theme of this film is a (self) recognition of white responsibility. This is played out through a 'medical' investigation into the body of Soho Eckstein, the white property-developing magnate and greedy-capitalist protagonist of most of the preceding films, which provides the starting point for a revelation of conscience. (tate.org.uk)",,[]
384,Il lato positivo,2012,"Pat esce dall'ospedale psichiatrico dopo otto mesi di trattamento con una sola idea in testa: rimettersi in forma e riconquistare la moglie Nikki. Un divieto di avvicinamento lo costringe, però, nel frattempo, in casa con la madre e il padre, che ha perso il lavoro e si è dato alle scommesse, e gli impone degli incontri settimanali con il dottor Patel. A questo punto, la già precaria autodisciplina di Pat viene sconvolta dall'incontro con Tiffany, giovane vedova con una recente storia di dipendenza da sesso e psicofarmaci. In cambio della sua intercessione presso Nikki, Tiffany vuole infatti che Pat le faccia da partner per un bizzarro concorso.",7.4,"['Netflix', 'Sky Go', 'Now TV', 'Amazon Prime Video']"
385,L'amore bugiardo - Gone Girl,2014,"Da poco trasferirtisi in una piccola cittadina del Missouri da New York, Nick Dunne (Ben Affleck) e la moglie Amy (Rosamunde Pike) stanno attraversando un periodo difficile, con un matrimonio in crisi per via della difficoltà della donna ad abituarsi alla nuova esistenza. Il giorno del quinto anniversario di nozze, Amy scompare e il primo ad essere sospettato della sua scomparsa è Nick ma la realtà è ben diversa da come appare a prima vista.",8.0,"['Netflix', 'Amazon Prime Video', 'Disney Plus']"
386,L'uomo d'acciaio,2013,"Poco prima che il pianeta Krypton venga definitivamente distrutto, lo scienziato Jor-El riesce a spedire il figlio neonato Kal-El sulla Terra, suscitando le ire del Generale Zod. Sul nostro pianeta Kal-El cresce con la consapevolezza di essere diverso e di avere un giorno una missione da portare a termine. Capirà che deve salvare il genere umano poco prima dell’arrivo di Zod, che intende seminare morte e devastazione.",6.8,['Netflix']
387,Prelude 3,1996,"Many white interruptive frames and absolutely straight-edged multi-colored lines amidst ""clouds"" of color, finally thickened into blobs with lengthy white (clear leader) spacing between them.",4.8,[]
388,In the Mood for Love,2000,"Hong Kong, 1962. I coniugi Chow e i coniugi Chan si trasferiscono lo stesso giorno in due appartamenti contigui. Sono il signor Chow e la signora Chan a rientrare più di frequente a casa ed è così che nel giro di breve tempo scoprono che i rispettivi consorti sono amanti. La volontà di comprendere le ragioni del tradimento subito li porterà a frequentarsi sempre più spesso e a condividere le sensazioni provate.",8.1,"['Mubi', 'Mubi Amazon Channel']"
389,Out of Control,2008,"Remote and alone, various personalities share feelings of solitude in the interior of a labyrinthine house",6.2,[]
390,A Million Inconsiderate Experiments,1996,"Survival Research Laboratories' fiery show in Phoenix. Staged Jan. 28, 1996. 23 minutes of hell on earth.",,[]
391,Dracula di Bram Stoker,1992,"Anno 1462, Costantinopoli era caduta. I musulmani turchi dilagavano in Europa, minacciando tutto il mondo cristiano. Dalla Transilvania si levò a difesa della chiesa un cavaliere rumeno del sacro ordine del Dragone, conosciuto come Draculia. Quando ritornò a casa, scoprì che Elisabeta, principessa romena nonché sua moglie, era morta suicida quando ricevette, dai turchi sconfitti, la falsa notizia della morte dell'amato marito. Alle parole del prete, che sentenziò la dannazione di Elisabeta in quanto suicida, rinnegò Dio e la chiesa, che aveva difeso, e diventò un vampiro.",7.4,['Netflix']
392,Scream,2022,"Venticinque anni dopo la serie di efferati e crudeli omicidi che sconvolse la tranquilla cittadina di Woodsboro, un nuovo assassino con la maschera di Ghostface prende di mira un gruppo di adolescenti, facendo ripiombare la città nel terrore e riaffiorare le paure di un passato che sembrava ormai sepolto.",6.5,[]
393,Ladies of the Church,2012,"Drama - Vivica A. Fox, Jean-Claude La Marre, Sheryl Lee Ralph",,[]
394,Gli Stati Uniti contro Billie Holiday,2021,"Negli anni Quaranta l’icona della musica jazz Billie Holiday collezionava successi in tutto il mondo, mentre il governo federale statunitense decideva di trasformare la Holiday nel capro espiatorio di una dura battaglia contro la droga prendendo di mira la sua fragile e complicata vita. Il fine ultimo delle azioni intraprese contro la cantante non era però legato alla droga, ma impedirle di eseguire la sua straziante ballata “Strange fruit”, grido di denuncia contro i linciaggi del governo degli U.S.A. e contributo essenziale per  il movimento per i diritti civili.",6.5,[]
395,Michael Che Matters,2016,"""SNL"" star Michael Che takes on hot-button topics like inequality, homophobia and gentrification in this stand-up set filmed live in Brooklyn.",7.0,['Netflix']
396,Go!! Karate Club,1992,"Tadashi Matsushita has recently entered the Kansai Fifth Technical High School and joined its notorious karate club. There he meets his captain, Yoshiyuki Takagi, an incredibly strong individual. Feared and respected throughout Osaka, Takagi is deep down an honorable and compassionate guy despite his violent endeavors.",6.6,[]
397,Captain Fantastic,2016,"Ben e la moglie hanno scelto di crescere i loro sei figli lontano dalla città e dalla società, nel cuore di una foresta del Nord America. Sotto la guida costante del padre, i ragazzi, tra i cinque e i diciassette anni, passano le giornate allenandosi fisicamente e intellettualmente: cacciano per procurarsi il cibo, studiano le scienze e le lingue straniere, si confrontano in democratici dibattiti sui capolavori della letteratura e sulle conquiste della Storia. Suonano, cantano, festeggiano il compleanno di Noam Chomsky e rifiutano il Natale e la società dei consumi. La morte della madre, da tempo malata, li costringe a intraprendere un viaggio nel mondo sconosciuto della cosiddetta normalità: viaggio che farà emergere dissidi e sofferenze e obbligherà Ben e mettere in discussione la sua idea educativa.",7.9,[]
398,Animali notturni,2016,"Susan riceve dall'ex marito un manoscritto su cui l'uomo vuole un'opinione. In quello che potrebbe essere un futuro libro, si racconta la storia di una vacanza destinata a trasformarsi in tragedia. Mentre si lascia prendere dallo scritto, Susan si ritrova a ricordare il suo primo matrimonio e ad affrontare alcune oscure verità che la riguardano.",7.5,"['Starz', 'Amazon Prime Video', 'Starz Play Amazon Channel']"
399,Hugh,1996,"Hugh is an elderly man keeping himself active in retirement.  His hobbies include teaching children to play the piano, carpentry and driving into town to preach sermons on the evils of homosexuality.",5.7,[]
400,Idiocracy,2006,"Joe Bowers è un militare che fa il suo dovere senza infamia e senza lode in attesa della pensione. Non sa che l'Esercito statunitense ha messo gli occhi su di lui perché, proprio in quanto perfetto rappresentante dell'uomo medio americano, può essere l'individuo giusto. Per cosa? Per un esperimento di criogenetica. Verrà ibernato (e insieme a lui, ma in un altro contenitore, una prostituta desiderosa di sfuggire al proprio protettore) e riportato in vita a tempo debito. Peccato che la realtà non rispetti i piani e che il degrado a cui gli States vanno incontro faccia sì che i due si risveglino nel 2505.",6.4,['Disney Plus']
401,Scary Movie,2000,"Tutto ha inizio con l'assassinio della bellissima studentessa liceale Drew Decker. I suoi compagni di classe scoprono che c'è un serial killer intorno a loro, anche se non sembra troppo originale... i suoi 'modi operandi' sono infatti ispirati ai classici horror degli ultimi anni. Cindy e i suoi amici devono proteggersi dal pericolo in ogni modo.",6.3,['Netflix']
402,Il mostro dei mari,2022,"In un’epoca in cui creature terrificanti solcano i mari, i cacciatori di mostri sono considerati veri e propri eroi. E il grande Jacob Holland è di certo il più osannato. Ma quando la giovane Maisie Brumble s’imbarca clandestinamente sulla sua nave leggendaria, l’uomo trova a sorpresa un’alleata. Insieme intraprendono un viaggio epico in acque inesplorate ed entrano nella storia. Il mostro dei mari conduce lo spettatore ai confini del mondo, dove ha inizio la vera avventura.",7.4,['Netflix']
403,(500) giorni insieme,2009,"Tom Hansen vive a Los Angeles, è un giovane scrittore di cartoline presso una società di biglietti d’auguri che si esercita anche per diventare un architetto. Alla società di cartoline arriva Sole Finn, la nuova assistente del capo, e viene presentata a Tom: per lui è subito colpo di fulmine, ma i due punti di vista nettamente contrari sull’idea di rapporti privati si fanno subito vedere e saranno alla causa della loro rottura.
 Un mese dopo il primo incontro, nel corso di un karaoke serale, McKenzie, amico e collega di Tom si lascia scappare davanti a Sole questo sentimento nascosto. Tom e Sole iniziano una relazione, ma se il ragazzo è un romantico che crede nel vero amore, Sole è molto schietta a riguardo e da subito fa presente a Tom come non sia interessata a impegnarsi e ad avere un fidanzato. Qualche settimana dopo il primo incontro, Tom ha un affronto con un ex ragazzo di Sole, e proprio per questo si apre con lei il primo litigio...",7.5,['Disney Plus']
404,Fury,2014,"Aprile 1945. Mentre gli alleati sferrano l’attacco decisivo in Europa, il sergente dell’esercito americano Don Collier, da tutti chiamato “Wardaddy” (Brad Pitt), guida un’unità di cinque soldati in una missione mortale dietro le linee nemiche a bordo di un carro armato Sherman (chiamato, appunto, “Fury”). Una missione temeraria ed eroica nel cuore della Germania nazista, ormai al collasso. In inferiorità numerica, disarmati e con una recluta giovane e inesperta nel plotone, Wardaddy e i suoi uomini dovranno ricorrere a tutto il proprio coraggio e alla propria arguzia per sopravvivere agli orrori della guerra.",7.5,"['Sky Go', 'Now TV']"
405,Escape Room 2 - Gioco mortale,2021,"Il sequel del thriller psicologico che nel 2019 ha terrorizzato il pubblico di tutto il mondo. In questo secondo capitolo sei persone si trovano involontariamente bloccate in un'altra serie di escape room, per sopravvivere dovranno svelare lentamente ciò che hanno in comune... e scopriranno che in passato tutti loro hanno già preso parte al gioco.",6.2,"['Sky Go', 'Now TV', 'Timvision']"
406,Attacco al potere - Olympus Has Fallen,2013,"Mike Banning è un agente della sicurezza al servizio del presidente degli Stati Uniti d'America. Brillante e intraprendente, è ben voluto dalla First Lady e da suo figlio, un ragazzino di pochi anni che sogna un giorno di servire il Paese. Alla Vigilia di Natale la donna muore in un tragico incidente, 'sacrificata' insieme a due agenti per salvare la vita del presidente. Sollevato dall'incarico e costretto dietro alla scrivania, Mike conduce una vita ordinaria a cui proprio non riesce ad abituarsi. L'attacco alla Casa Bianca da parte di un gruppo di estremisti nord coreani, che vorrebbero 'detonare' gli States, gli offre finalmente l'occasione di tornare operativo. Sopravvissuto ai colleghi caduti come mosche nei corridoi della residenza presidenziale, Mike prova a raggiungere il bunker dove il Presidente è tenuto in ostaggio con il suo staff. Mentre l'America trattiene il respiro, l'agente Banning si riprende gloria e reputazione.",6.5,"['Sky Go', 'Now TV']"
407,Sinister,2012,"La storia del film si sviluppa intorno ad un romanziere di cronaca nera che fatica a trovare uno scoop. Così decide di trasferirsi con moglie e figli in una casa dove ha avuto luogo l'orribile assassinio di una intera famiglia. Ma, dopo aver trovato in una scatola alcune videocasette che mostrano i brutali omicidi di altre famiglie, la sua indagine lo porterà alla scoperta di un'entità soprannaturale che sta minacciando anche i suoi familiari.",6.8,"['Rakuten TV', 'VVVVID']"
408,"Crazy, Stupid, Love.",2011,"Cal Weaver e signora sono sposati da venticinque anni, hanno due figli e pochi problemi. Almeno fino a quando lei non lo informa di averlo tradito con un collega e di desiderare il divorzio. Improvvisamente single, Cal finisce ad ubriacarsi ogni sera di vodka al mirtillo in un bar dove non aveva mai messo piede prima, evitato da tutte tranne che dalla babysitter di suo figlio, una diciassettenne perseguitata dal ragazzino ma cotta del padre. L'autocommiserazione ostentata di Cal, al bancone del bar, infastidisce Jacob Palmer, giovane seduttore seriale, che si ripromette di aiutarlo a dimenticare la moglie e a tornare in pista.",7.3,['Netflix']
409,Madre,2009,"Do-joon è un ragazzo con problemi mentali, bizzarro ma apparentemente inoffensivo, che viene accusato del brutale omicidio di una ragazza. La madre si rifiuta di accettare questa verità e, dopo aver compreso che polizia e avvocati non vogliono fare niente per sovvertire l'andamento delle cose, si impegna da sola nell'impresa di scoprire il vero colpevole e scagionare così il figlio.",7.8,['Amazon Prime Video']
410,Il traditore,2019,"Palermo, Sicilia, 1980. Il mafioso Tommaso Buscetta decide di trasferirsi in Brasile con la famiglia per sfuggire alla costante guerra tra i diversi clan dell'organizzazione criminale. Ma quando, dopo aver vissuto diverse disgrazie, è costretto a tornare in Italia, prende una decisione coraggiosa che cambierà per sempre la sua vita e il destino di Cosa Nostra.",7.4,"['Rai Play', 'Disney Plus']"
411,Il ritratto del duca,2020,"Nel 1961, Kempton Bunton, un tassista di 60 anni, rubò dalla National Gallery di Londra il Ritratto del duca di Wellington di Francisco Goya. Kempton chiese un inconsueto riscatto: avrebbe restituito il dipinto solo se il governo si fosse impegnato di più a sostegno degli anziani, per i quali si era già battuto in precedenza. Solo 50 anni dopo si è scoperto che Kempton aveva intessuto una rete di bugie. L'unica verità era che era un brav'uomo determinato a cambiare il mondo e a salvare il suo matrimonio. Il racconto di come ""il Duca"" lo abbia aiutato in questo è una storia meravigliosamente ispiratrice.",7.0,[]
412,Fondazione,2021,"Una serie basata sui celebri romanzi di Isaac Asimov, Fondazione racconta il grandioso viaggio di un gruppo di esiliati con lo scopo di salvare l’umanità e ricostruire la civiltà durante la caduta dell’Impero Galattico.",7.7,['Apple TV Plus']
413,Il rabdomante,2007,"Felice, uno schizofrenico che vive completamente isolato dal resto del mondo in una masseria, situata alla periferia della città di Matera. Qui aiuta i contadini a trovare l'acqua, mettendosi subito in contrasto con un malavitoso che ne ha il completo controllo. Intanto si fa avanti una venticinquenne dell'Est, Harja, compagna del boss. Rimasta incinta cerca in tutti i modi di scappare. Fugge e si rifugia nella masseria di Felice. I due hanno in comune un passato difficile e una profonda solitudine che li attanaglia…",7.0,[]
414,The Northman,2022,"All'inizio del X secolo, il giovane Amleth, un principe norreno, vede suo padre, il re Aurvandil, venire assassinato dallo zio Fjölnir che usurpa il trono e costringe la vedova, Gudrun, a restargli accanto come regina. Allontanatosi dal regno, vent'anni dopo Amleth è diventato un berserkr - un feroce guerriero - e si dirige alla volta dell'Islanda, dove risiede lo zio, nel frattempo decaduto. Lungo il suo percorso incontrerà Olga, una ragazza della Foresta delle Betulle caduta schiava, che diventerà sua compagna e complice nella missione.",7.1,[]
415,1883,2021,Segui la famiglia Dutton mentre intraprende un viaggio verso ovest attraverso le Grandi Pianure verso l'ultimo bastione dell'America selvaggia. Una cruda rivisitazione dell'espansione occidentale e uno studio intenso di una famiglia che fugge dalla povertà per cercare un futuro migliore nella terra promessa dell'America: il Montana.,8.7,[]
416,Profumo di donna,1992,"Frank Slade, colonello in pensione, diventato cieco a causa di un incidente, si reca a New York per la festa del ringraziamento, deciso a trascorrere un week-end indimenticabile senza farsi mancare assolutamente nulla. In questa avventura lo accompagna Charlie, uno studente, il rapporto sarà difficile, divertente ed allo stesso tempo tragico, perchè il colonello ha deciso che quello sarà il suo ultimo week-end.",7.9,[]
417,Snowpiercer,2013,"2031. Dopo il fallimento di un esperimento per contrastare il riscaldamento globale, una vera e propria Era Glaciale stermina tutti gli abitanti del pianeta. Gli unici sopravvissuti sono i viaggiatori che hanno lottato con tutte le loro forze per procurarsi un biglietto ed aggiudicarsi un posto a bordo dello Snowpiercer, un treno ad alta velocità che fa il giro del mondo e che trae energia da un motore in moto perpetuo. Questo treno è l’unico mezzo che garantisce la sopravvivenza, diventando un microcosmo di società umana diviso in classi sociali: i più poveri stipati nelle ultime carrozze; i più ricchi nei lussuosi vagoni anteriori. La difficile convivenza ed i delicati equilibri tra classi non
 potranno che sfociare inevitabilmente in lotte e rivoluzioni.",7.0,"['Sky Go', 'Now TV', 'Timvision', 'Amazon Prime Video', 'VVVVID']"
418,'71,2014,"Nel 1971 il conflitto in Irlanda del Nord sta diventando una vera e propria guerra civile. La situazione è complicata dalla presenza non solo delle due fazioni cattolica e protestante, ma anche di bande paramilitari e agenti infiltrati. Una notte, durante un pattugliamento, la giovane recluta Gary smarrisce l'arma di ordinanza, rubata in una colluttazione. Inseguendo il colpevole, Gary si troverà solo in territorio ostile e il ritorno alla base diventerà un vero incubo.",7.0,['Now TV']
419,Storia di un matrimonio,2019,"Una coppia decide di divorziare. In tribunale lo scontro diventerà pian piano sempre più aggressivo, anche per via dei legali che rappresentano i due coniugi.",7.8,['Netflix']
420,The Blind Side,2009,"Michael Oher, detto Big Mike per la sua imponente statura, è un adolescente della periferia di Memphis, abbandonato a se stesso da un padre sconosciuto e una madre tossicodipendente. Quando un suo amico lo introduce all'allenatore della Wingate Christian School come giovane promessa dello sport, questi fa di tutto perché Big Mike venga accettato dalla scuola a dispetto degli scarsi risultati ottenuti nei test attitudinali. Questo ragazzone di colore solitario e silenzioso che pulisce la palestra dopo ogni incontro sportivo e indossa sempre la stessa t-shirt, attira le attenzioni della famiglia Tuohy e in particolare di Leigh Anne, risoluta arredatrice dal cuore d'oro e dall'abbigliamento impeccabile, che una sera decide di accoglierlo sotto il suo tetto.",7.6,"['Netflix', 'Sky Go', 'Now TV', 'Amazon Prime Video']"
421,HollyBlood,2022,"Javi è un adolescente normale che vorrebbe solo che Sara, la ragazza di cui è innamorato, si accorgesse di lui. Lei però ha una vera e propria fissazione per HollyBlood, una saga fantasy di vampiri, al punto che, quando lui sta finalmente per dichiararsi, una serie di malintesi la porta a credere addirittura che Javi sia un vampiro. A quel punto però si troveranno, insieme ad altri ragazzi appassionati di storie dell'orrore, a fronteggiare una minaccia soprannaturale che pare risiedere nella loro scuola.",6.8,['Netflix']
422,Punto di non ritorno,1997,"Nel 2047 la Event Horizon, astronave in grado di viaggiare oltre la velocità della luce, scompare mentre è in orbita intorno al pianeta Nettuno. Trentacinque anni dopo ristabilisce i contatti. Dalla Terra parte una squadra di astronauti, comandata dal cap. Miller, con a bordo lo scienziato Weir, progettista della Event Horizon. La raggiungono, ma la trovano vuota. Tutti i membri dell'equipaggio sono colpiti da inquietanti allucinazioni, riferite al loro passato.",6.5,['Amazon Prime Video']
423,Fast & Furious 8,2017,"Ora che Dom e Letty sono in luna di miele e Brian e Mia si sono ritirati ed il resto del gruppo è stato esonerato, il team giramondo ha trovato una parvenza di vita normale. Ma il gruppo sarà messo a dura prova come mai prima d'ora quando una donna misteriosa irretisce Dom per indurlo a ritornare al mondo del crimine, dal quale lui tenta invano di sfuggire e a fargli tradire coloro che gli sono più cari.  Dalle coste di Cuba e le strade di New York fino alle distese ghiacciate del Mare di Barents, la nostra squadra d'élite attraverserà il globo per impedire a un ribelle di scatenare il caos in tutto il mondo e per riportare a casa l'uomo che li aveva resi una famiglia.",6.8,[]
424,Il potere del cane,2021,"Un ranchero autoritario e carismatico reagisce con beffarda crudeltà quando il fratello porta a casa la nuova moglie e il figlio di lei, finché non accade l'imprevisto.",6.8,['Netflix']
425,Cinquanta sfumature di rosso,2018,"Anastasia e il suo principe, Christian Grey, convolano a nozze, e in un attimo, con un colpo di bacchetta, i discorsi tra loro si adeguano alla nuova situazione: lui non ha piacere che lei prenda il sole in topless, inoltre preferirebbe che cambiasse il suo cognome nell'indirizzo email del lavoro, da Steele in Grey, e che rientrasse a casa alla sera senza tergiversare per i fatti suoi. L'argomento figli, poi, meglio lasciarlo per il futuro, perché la sola idea lo fa sbiancare, nonostante in giro si dica che non abbia paura di nulla.",5.6,[]
426,Drive,2011,"Driver (non ha un nome) ha più di un lavoro. È un esperto meccanico in una piccola officina. Fa lo stuntmen per riprese automobilistiche e accompagna rapinatori sul luogo del delitto garantendo loro una fuga a tempo di record. Ora Driver avrebbe anche una nuova opportunità : correre in circuiti professionistici. Ma le cose vanno diversamente. Driver conosce e si innamora di Irene, una vicina di casa, e diventa amico di suo figlio Benicio. Irene però è sposata e quando il marito, Standard, esce dal carcere la situazione precipita. Perché Standard ha dei debiti con dei criminali i quali minacciano la sua famiglia. Driver decide allora di fargli da autista per il colpo che dovrebbe sistemare la situazione. Le cose però non vanno come previsto.",7.7,['Netflix']
427,Into the Wild - Nelle terre selvagge,2007,"Basato su una storia vera. Dopo aver conseguito la laurea alla Emory University, il ventiduenne Christopher McCandless (Emile Hirsch) abbandona la sua vita agiata, da’ in beneficenza i suoi risparmi (24.000 dollari) e parte in un viaggio verso l’ignoto. Il percorso di Christopher lo porta tra l’altro ad attraversare i campi di grano del Sud Dakota e a viaggiare controcorrente lungo il fiume Colorado: Chris incontrerà una serie di pittoreschi personaggi che cambieranno per sempre la sua visuale della vita, e si spingerà ancora oltre per raggiungere l’Alaska e vivere in mezzo alle “terre selvagge” del Nord del Paese.",8.0,"['Mubi', 'Mubi Amazon Channel']"
428,Perfect Blue,1997,La Idol Mima decide di lasciare il mondo della musica per dedicarsi alla carriera di attrice. Questa scelta scatena l'ira di alcuni fan.,8.1,[]
429,Godzilla vs. Kong,2021,"In un momento in cui i mostri camminano sulla Terra, la lotta dell'umanità per il suo futuro fa scatenare Godzilla e Kong su una rotta di collisione che vedrà le due forze più potenti della natura sul pianeta scontrarsi in una spettacolare battaglia per secoli. Mentre Monarch intraprende una pericolosa missione in un terreno inesplorato e scopre indizi sulle origini dei Titani, una cospirazione umana minaccia di spazzare via per sempre le creature, sia buone che cattive, dalla faccia della terra.",7.0,[]
430,1917,2019,"Al culmine della prima guerra mondiale, due giovani soldati britannici, Schofield e Blake ricevono una missione apparentemente impossibile. In una corsa contro il tempo, devono attraversare il territorio nemico e consegnare un messaggio che arresterà un attacco mortale contro centinaia di soldati, tra cui il fratello di Blake.",8.1,"['Netflix', 'Timvision', 'Infinity', 'Amazon Prime Video', 'Infinity Selection Amazon Channel']"
431,Resurrection,1999,"After a woman is crippled in an auto accident which killed her husband, she suddenly develops the powers to heal. First she uses the power to heal herself and then turns to others. However, her powers are beyond healing psychic scars that exist between her and her mother. Meanwhile, her best friend and her doctor struggle to understand her newfound abilities.",5.4,[]
