,title,year,text,rating,providers
0,Star Wars: Episodio I - La minaccia fantasma,1999,"Il regno pacifico di Naboo denuncia l'imminente invasione da parte della Lega dei Commercianti, ma la Repubblica, paralizzata dalla corruzione dilagante e dalla burocrazia del Senato, sceglie di non intervenire. Solo i Cavalieri Jedi Qui-gon Jin e Obi-wan Kenobi si recano a Naboo per proteggere la regina Amidala, in pericolo di vita, e condurla in salvo sul pianeta Tatooine. Qui i Jedi faranno la conoscenza di un bambino fuori dall'ordinario, Anakin Skywalker: Qui-gon è convinto che si tratti del Prescelto, destinato un giorno a riportare equilibrio nella Forza.",6.5,['Disney Plus']
1,Star Wars: Episodio II - L'attacco dei cloni,2002,"La Repubblica governata dal cancelliere Palpatine è entrata in crisi a causa del blocco in atto sul pianeta Naboo da parte della Federazione; un gruppo di dissidenti comandato dal Jedi conte Dooku manifesta il malcontento per ciò che sta accadendo. Alcuni membri del Senato chiedono che la Repubblica venga dotata di un esercito in grado di fronteggiare la situazione. Nel frattempo Amidala - diventata Senatrice e minacciata dai separatisti - è sfuggita a un attentato: la sua protezione viene affidata a Anakin Skywalker. Nel tentativo di scoprire gli ideatori del complotto, Obi-Wan Kenobi viene a conoscenza dell'esistenza di un misterioso esercito di cloni...",6.6,['Disney Plus']
2,Star Wars: Episodio III - La vendetta dei Sith,2005,"Tre anni dopo l'inizio della Guerra dei Cloni il lungo ed estenuante conflitto sta per giungere ad una conclusione. Obi-Wan Kenobi e Anakin Skywalker stanno per avere rivelazioni sconvolgenti. Il pianeta Coruscant è sotto attacco e per mano del Generale Grievous, il loro compito è di assicurare il Generale alla giustizia, ma il Cancelliere Palpatine sta trasformando la Repubblica in un regime tirannico, nonostante l'opposizione dell'Ordine degli Jedi e di pochi senatori ancora non corrotti. Anakin, divenuto sempre più vicino al Cancelliere, nel frattempo soffre di moleste visioni a proposito della Senatrice Padme Amidala, sposata in segreto. Sin dall'inizio della Guerra dei Cloni si è andato avvicinando sempre più al Lato Oscuro della Forza, incoraggiato da Palpatine, e presto lo scontro diverrà inevitabile. Obi-Wan Kenobi non avrà altra scelta che confrontarsi col suo antico apprendista in una battaglia mentre si affaccia un nuovo conflitto che determinerà il destino della Galassia.",7.5,['Disney Plus']
3,Star Wars: Gli ultimi Jedi,2017,"Mentre il Primo Ordine si prepara a stroncare quel che resta della Resistenza, Rey consegna a Luke Skywalker la spada laser che fu sua, invitandolo a interrompere il suo esilio per salvare il mondo libero. Ma Luke non ne vuole sapere e il Lato Oscuro tesse la sua trama letale attorno agli ultimi ribelli.",6.9,['Disney Plus']
4,Star Wars: L'ascesa di Skywalker,2019,"La resistenza è ridotta a poche unità, il primo ordine dilaga sotto il comando del leader supremo Kylo Ren, ma un messaggio ha turbato la galassia. L'imperatore Palpatine giura vendetta! Ren si mette così alla ricerca dell'origine della trasmissione e arriva a confrontarsi con Palpatine, che gli offre una spaventosa flotta se saprà eliminare la ragazza Jedi, Rey. Questa combatte e si addestra seguendo gli insegnamenti del generale Organa, mentre Finn, Poe e Chewbacca ricevono messaggi da una spia nel Primo Ordine.",6.5,['Disney Plus']
5,Matrix,1999,"Seguendo un tatuaggio sulla spalla di una ragazza, l'hacker Neo scopre che la cosiddetta ""realtà"" è solo un impulso elettrico fornito al cervello degli umani da un'intelligenza artificiale. Per sopravvivere alla catastrofe l'umanità ha infatti avuto bisogno delle macchine, ma queste hanno vinto e necessitano degli uomini come fonte di energia. L'illusione in cui li fanno vivere è quindi finalizzata a ""coltivarli"" meglio. Nessuno è a conoscenza del tempo che è passato da quando il neurosimulatore ha assegnato una data fittizia al tempo. Solo Neo, con l'aiuto del pirata informatico Morpheus e della bella Trinity, può tentare di scoprire la verità, ma non sarà un'impresa facile.",8.4,[]
6,Matrix Reloaded,2003,"Ora Neo controlla perfettamente i suoi straordinari poteri e Zion è assediata dall'Esercito delle Macchine. Solo poche ore separano l'ultima enclave umana sulla Terra da 250.000 Sentinelle programmate per distruggere il genere umano. Ma i cittadini di Zion, incoraggiati dalla convinzione di Morpheus che L'Eletto adempierà la Profezia dell'Oracolo e metterà fine alla guerra con le Macchine, puntano tutte le loro speranze su Neo, che si ritrova bloccato da visioni sconvolgenti. Resi più forti dall'amore e dalla fiducia che li lega, Neo e Trinity scelgono di tornare in Matrix con Morpheus e di lottare contro le forze della repressione e dello sfruttamento. Ma esistono ancora figure potenti dentro Matrix che si oppongono all'artificio della scelta, e si sottraggono alla responsabilità che comporta, poiché si cibano delle verità emotive degli altri.",7.1,[]
7,Matrix Revolutions,2003,"Neo è in coma nell'infermeria della Hammer, ma la sua mente si trova intrappolata in una sorta di limbo situato tra il mondo reale e matrix. Il creatore del limbo virtuale è un nuovo personaggio, enigmatico e misterioso quanto la figura del fabbricante di chiavi, ma con un dentista decisamente peggiore. Toccherà ai compagni di Neo l'arduo compito di liberarlo, tornando nel castello del Merovingio, che muove i fili del gioco. Riuscirà Zion a resistere all'inesorabile avanzata delle macchine? Potrà l'eletto sconfiggere il suo nemico giurato, l'agente Smith?",6.7,[]
8,Triangle of Sadness,2022,"A fashion model celebrity couple, Carl and Yaya, are invited to a luxury cruise for the uber-rich, run by a Marxist captain, only for things to go wrong.",7.8,[]
9,"La leggenda di Al, John e Jack",2002,"New York 1959. I tre gangster Al, John e Jack hanno il compito di uccidere Frankie per conto del boss. Sbagliano bersaglio e il boss da a loro un'altra possibilità: tenere d'occhio una persona a lui cara. Ma la fortuna non è dalla loro parte....",6.7,"['Infinity', 'Disney Plus', 'Infinity Selection Amazon Channel']"
10,40 anni vergine,2005,"Andy Stitzer è un quarantenne con una vita traquilla e piuttosto serena; ha una bella casa, un lavoro, dei buoni amici, una collezione di fumetti e di action figures di cui va fiero. C'è solo una cosa che proprio gli manca: non ha mai fatto sesso. Anche se questo per lui non sembra essere un problema, i suoi amici non la pensano così e tentano in tutti i modi di risolvere la questione, senza però avere successo. Fino al giorno in cui Andy conosce Trish. E' finalmente arrivato il momento giusto?",6.7,['Netflix']
11,Viaggio al centro della Terra,2008,"Alla ricerca di un collega scomparso, un professore universitario si ritrova al centro della Terra col nipote e un'affascinante islandese. Appassionato di Verne, userà il celebre romanzo come guida. Nell'immaginifico Mondo sotterraneo il trio trova uccellini luminosi, oceani, piante carnivore giganti, mostri marini e dinosauri.",5.9,"['Sky Go', 'Now TV', 'Amazon Prime Video']"
12,LEGO Batman - Il film,2017,"Durante una missione volta a impedire a Joker di distruggere Gotham City, Batman ferisce i sentimenti del suo arcinemico dicendogli che non è importante nella sua vita quanto Superman. Il giorno seguente, Batman partecipa al gala invernale della città per celebrare il pensionamento del commissario Gordon. Durante l'evento Barbara Gordon prende il posto del padre in qualità di commissario di polizia di Gotham e annuncia il suo piano per rinforzare il corpo di polizia cittadino in modo che non abbia più bisogno di Batman, cosa che fa infuriare il giustiziere. Joker e tutti i criminali di Gotham fanno irruzione alla festa solo per arrendersi a Batman. A causa di questo Batman realizza che presto non ci sarà più bisogno di lui. In seguito il maggiordomo Alfred rivela a Bruce che questi ha adottato l'orfano Dick Grayson e lo convince a prenderlo sotto la sua ala come Robin.",7.3,[]
13,Come ti rovino le vacanze,2015,Un giovane padre di famiglia che decide di sorprendere sua moglie Debbie (Christina Applegate) e i loro due figli. Organizzerà un’indimenticabile vacanza on the road alla volta di un famoso parco divertimenti. Ma non tutto filerà liscio…,6.2,['Netflix']
14,Il pianista,2002,"È la storia di Wladyslaw Szpilman, pianista ebreo polacco, attraverso la Seconda Guerra Mondiale, dall’occupazione di Varsavia all’arrivo dell’Armata Rossa. Il film è diviso in due parti: la prima è incentrata sulla famiglia Szpilman, dall’iniziale mix di stupore e indignazione per le leggi razziali alla reclusione nel ghetto, infine alla deportazione; col treno che parte, e Wladyslaw che rimane giù, inizia la seconda parte, la fuga del pianista, il suo continuo cambiar nascondiglio, sempre a un passo dalla cattura, a mezzo dalla morte, a nessuno dall’orrore che in quegli anni ha avvolto Varsavia – non solo Varsavia.",8.4,[]
15,"Good Bye, Lenin!",2003,"Germania dell'Est, 1989: il giovane Alexander Kerner protesta contro il regime e viene arrestato. Sua madre Christiane ha un attacco cardiaco e finisce in coma. Qualche mese più tardi, dopo il crollo del Muro, Christiane si sveglia. Per evitarle emozioni troppo forti, Alexander cerca di mantenere in vita il passato mettendo in atto ogni possibile stratagemma. Ma il mondo è irreversibilmente cambiato...",7.6,[]
16,Tina & Bettina - The Movie,2012,"In Western Europe, on the west side of Scandinavia, on the west side of Oslo, is the greatest place on earth - Smestad. This is where Tina and Bettina lives, the most popular teen girls in high school. With a teen life filled with blogging, boys and parties, everything is great for the girls, right up until they stand before a terrible problem - immigration.",3.3,[]
17,Tu mi nascondi qualcosa,2018,"Valeria è un’investigatrice privata distratta che, pedinando la persona sbagliata, rivela a Francesco che la moglie lo tradisce. Alberto è un uomo che in seguito ad un incidente perde la memoria e al cui capezzale si presentano ben due mogli. Linda fa la pornostar, ma il suo compagno Ezio non mostra segni di gelosia finché non inizia a sospettare che lei abbia una relazione con l’attore con cui “lavora” sul set.",5.2,"['Amazon Prime Video', 'Infinity Selection Amazon Channel']"
18,#ScrivimiAncora,2014,"Rosie e Alex sono migliori amici. Improvvisamente, sono costretti a separarsi quando Alex e la sua famiglia devono trasferirsi da Dublino all'America. Potrà mai la loro amicizia superare il tempo e la distanza? Saranno i due ragazzi in grado di giocarsi il tutto e per tutto per il vero amore?",7.5,"['Amazon Prime Video', 'Infinity Selection Amazon Channel']"
19,The Equalizer 2 - Senza perdono,2018,"Robert McCall, in passato agente segreto, vive ora in un quartiere popolare a Boston, Massachusetts, e si guadagna da vivere facendo l'autista. La sua amica Susan viene incaricata delle indagini su un apparente omicidio-suicidio avvenuto a Bruxelles in coppia con Dave York, un tempo collega di McCall. L'investigatrice viene però attirata in un tranello e a quel punto Robert entra in azione.",6.7,['Netflix']
20,Mine vaganti,2010,"""Non farti mai dire dagli altri chi devi amare, e chi devi odiare. Sbaglia per conto tuo, sempre."" È il monito che l'anziana nonna rivolge al nipote Tommaso rientrato a casa da Roma deciso ad affermare le proprie scelte personali anche a costo di scontrarsi con la famiglia. Quella di Tommaso, il figlio minore dei Cantone proprietari di un pastificio in Puglia, è una famiglia numerosa e stravagante. In casa c'è molta attesa per il suo ritorno: la nonna ribelle e intrappolata nel ricordo di un amore impossibile, la mamma Stefania, amorosa ma soffocata dalle convenzioni borghesi, il padre Vincenzo deluso nelle aspettative sui figli, la zia Luciana a dir poco eccentrica, la sorella Elena che rifugge un destino da casalinga, il fratello Antonio da affiancare nella nuova gestione del pastificio di famiglia.",7.2,"['Netflix', 'Sky Go', 'Now TV', 'Disney Plus']"
21,Shadow,2018,"In un regno governato da un giovane e imprevedibile re, il visionario gran generale dell'esercito è un mosso dal solo desiderio di vincere l'ultima battaglia grazie alla sua arma segreta: la sua ombra, un sosia, in grado di confondere sia i suoi nemici che il re in persona. Ed è grazie a quest'ombra che tesserà un intricato piano per far trionfare il popolo, in una guerra che il re non vuole vincere.",6.9,['Amazon Prime Video']
22,Il sapore del successo,2015,"Adam Jones è un noto chef, con due stelle Michelin, che ha visto fallire il suo ristorante di Parigi, a causa della droga e dell'alcool. Dopo essere scomparso per tre anni, passati in Louisiana a sgusciare un milione di ostriche, decide di rimettersi in gioco aprendo un nuovo ristorante a Londra.",6.5,"['Netflix', 'Timvision', 'Amazon Prime Video']"
23,"Woodstock 99: Peace, Love, and Rage",2021,"Explore Woodstock 99, a three-day music festival promoted to echo unity and counterculture idealism of the original 1969 concert but instead devolved into riots, looting and sexual assaults.",6.8,[]
24,Play On,2017,"What happens when subcontracted precarious workers turn into podcast DJ. Subcontracted precarious workers at the SK Broadband, Inc. began a podcast titled ‘Workers Have Changed!’ to broadcast the story about their strike for job security. The podcast studio becomes a theater of their life as they share their stories - daily hardshipsof subcontracted labor, coping with rude customers, and their futures and dreams.",,[]
25,Finale a sorpresa - Official Competition,2021,"Alla ricerca di riconoscimento e prestigio sociale, un uomo d’affari miliardario decide di fare un film che lasci il segno. Per riuscirci, assume i migliori: un cast stellare formato dalla famosa regista Lola Cuevas e da due rinomati attori, entrambi di enorme talento, ma con un ego ancora più grande: Félix Rivero, attore hollywoodiano, e Iván Torres, illustre interprete del teatro radicale. Entrambi delle leggende, ma non proprio in buoni rapporti. Attraverso una serie di sfide sempre più eccentriche lanciate da Lola, Felix e Iván devono confrontarsi non solo l’un l’altro, ma anche con il loro lascito artistico.",6.9,"['Sky Go', 'Now TV']"
26,David Blaine: What Is Magic?,2010,"David Blaine travels around America to perform tricks in the UK premiere of his show What Is Magic? He visits New Orleans where he carries out a money trick in front of locals, producing hundreds of dollars at their fingertips before stopping off at New York to conduct magic in front of Orlando Bloom.  But the jewel in David's crown is his shot at the infamous The Bullet Catch; a trick which sees a 22 calibre bullet being fired at point blank range directly at the magician who then has to catch the bullet in a small metal cup in his mouth. The stunt is filmed using Phantom Camera technology which shoots 10,000 frames per second so that not a fraction of the action is missed.",7.0,[]
27,Mad Max: Fury Road,2015,"Ossessionato dal suo turbolento passato, Mad Max crede che il modo migliore per sopravvivere sia muoversi da solo, ma si ritrova coinvolto con un gruppo in fuga attraverso la Terre Desolata su un blindato da combattimento, guidato dall’imperatrice Furiosa. Il gruppo è sfuggito alla tirannide di Immortan Joe, cui è stato sottratto qualcosa di insostituibile. Furibondo, l’uomo ha sguinzagliato tutti i suoi uomini sulle tracce dei ribelli e così ha inizio una guerra spietata.",7.8,[]
28,Io sono nessuno,2021,"Hutch Mansell, padre e marito sottostimato e trascurato, è abituato a non reagire a nessuna umiliazione. Quando una notte due ladri irrompono nella sua abitazione in periferia, rifiuta di difendere se stesso o la sua famiglia, sperando di prevenire violenze maggiori. Il figlio adolescente Blake è deluso dal suo comportamento e la moglie Becca comincia ad allontanarsi maggiormente da lui. All'indomani dell'accaduto, la rabbia che Hutch cova esplode spingendolo a manifestare tutta la violenza di cui è capace. Si ritroverà allora a dover difendere come meglio può la sua famiglia da un pericoloso avversario e ad assicurarsi di non essere mai più sottovalutato da nessuno.",7.8,"['Sky Go', 'Now TV']"
29,Freaks Out,2021,"Roma, 1943: Matilde, Cencio, Fulvio e Mario vivono come fratelli nel circo di Israel. Quando Israel scompare misteriosamente, forse in fuga o forse catturato dai nazisti, i quattro ""fenomeni da baraccone"" restano soli nella città occupata. Qualcuno però ha messo gli occhi su di loro, con un piano che potrebbe cambiare i loro destini... e il corso della Storia.",7.2,"['Sky Go', 'Now TV', 'Amazon Prime Video']"
30,Esterno notte,2022,"1978. L'Italia è dilaniata da una guerra civile. Da una parte le Brigate Rosse, la principale delle organizzazioni armate di estrema sinistra, e dall'altra lo Stato. Violenza di piazza, rapimenti, gambizzazioni, scontri a fuoco, attentati. Sta per insediarsi, per la prima volta in un paese occidentale un governo sostenuto dal Partito Comunista (PCI), in un'epocale alleanza con lo storico baluardo conservatore della Nazione, la Democrazia Cristiana (DC). Aldo Moro, il Presidente della DC, è il principale fautore di questo accordo, che segna un passo decisivo nel reciproco riconoscimento tra i due partiti più importanti d'Italia. Proprio nel giorno dell'insediamento del governo che con la sua abilità politica è riuscito a costruire, il 16 marzo 1978, sulla strada che lo porta in Parlamento, Aldo Moro viene rapito con un agguato che ne annienta l'intera scorta.",8.1,[]
31,Quei bravi ragazzi,1990,"Henry Hill, figlio di emigranti italo-irlandesi, fin da giovane entra a far parte della piccola mafia dei quartieri poveri di New York. Ma ben presto scopre la ferocia dei boss locali che usano chiamarsi fra di loro ""bravi ragazzi""...",8.6,"['Netflix', 'Sky Go', 'Now TV']"
32,Barry Seal - Una storia americana,2017,"1979. Jimmy Carter sciocca la nazione con il suo discorso sulla ""crisi di fiducia"", mentre il popolo si prepara a votare Reagan. Barry Seal, pilota di aerei di linea che arrotonda con il contrabbando, viene contattato dalla CIA per spiare le attività dei guerriglieri sandinisti in Nicaragua. Sarà l'inizio di una serie di opportunità, sempre meno lecite e sempre più rischiose. La storia di Hollywood è piena di autori che hanno scelto di divenire lavoratori su commissione, sviluppando un mimetismo esemplare e prestandosi ai progetti più disparati. Quello di Doug Liman sembrava uno di questi casi, ma in Barry Seal qualche traccia dello spirito che infondeva Swingers, delizioso debutto scritto da Jon Favreau, è possibile ritrovarla.",7.0,"['Netflix', 'Amazon Prime Video']"
33,America Latina,2021,"Latina: paludi, bonifiche, centrali nucleari dismesse, umidità. Massimo Sisti è il titolare di uno studio dentistico che porta il suo nome. Professionale, gentile, pacato, ha conquistato tutto ciò che poteva desiderare: una villa immersa nella quiete e una famiglia che ama e che lo accompagna nello scorrere dei giorni, dei mesi, degli anni. La moglie Alessandra e le figlie Laura e Ilenia (la prima adolescente, la seconda non ancora) sono la sua ragione di vita, la sua felicità, la ricompensa a un’esistenza improntata all’abnegazione e alla correttezza. È in questa primavera imperturbabile e calma che irrompe l’imprevedibile: un giorno come un altro Massimo scende in cantina e l’assurdo si impossessa della sua vita.",6.2,"['Sky Go', 'Now TV']"
34,Pane e tulipani,2000,"Durante una gita turistica in pullman, Rosalba, casalinga di Pescara, viene dimenticata in un autogrill. Un po' offesa, invece di aspettare che marito e figli vengano a riprenderla, decide di tornare da sola a casa. Si trova però su un auto diretta a Venezia, dove lei arriva per la prima volta e sente di voler rimanere. Mimmo, il marito, non sa come comportarsi, finché scopre che Costantino, un suo dipendente, è un appassionato di libri gialli e allora lo spedisce a Venezia con il compito di ritrovare la moglie. Rosalba intanto ha trovato lavoro nel negozio di fiori di Eliseo, un anziano anarchico, e vive a casa di Fernando, uno strano signore di origini islandesi che fa il cameriere-",7.3,"['Mubi', 'Mubi Amazon Channel', 'Rai Play']"
35,Fargo,1996,"Jerry Lundegaard gestisce una concessionaria di Oldsmobile e ha un impellente bisogno di denaro liquido. Escogita il rapimento della moglie per ottenere un cospicuo riscatto dal suocero ostile. Ingaggia due crudeli quanto incapaci malviventi che riescono a tramutare il dramma in tragedia. Sarà l'intervento di Marge Gunderson, capo della polizia locale, al settimo mese di gravidanza, a risolvere la situazione.",8.0,['Amazon Prime Video']
36,La serie di Cuphead!,2022,Segui le avventure dell'impulsivo Cuphead e del suo fratello facilmente influenzabile Mugman in questa serie animata nata dal videogioco di successo.,7.7,['Netflix']
37,Lui è tornato,2015,"Adolf Hitler si risveglia improvvisamente a sessantasei anni dalla sua supposta morte. Nella moderna Berlino, si ritrova senza guerra, senza un partito e senza Eva, e per di più circondato da un clima di pace, migliaia di stranieri e Angela Merkel. Contro ogni probabilità, deve ricominciare da capo e trova lavoro in televisione, dove tutti credono sia un comico.",6.9,[]
38,Blood Diamond - Diamanti di sangue,2006,"Danny Archer è un ex mercenario della Rhodesia che contrabbanda diamanti durante la guerra civile, scoppiata in Sierra Leone sul finire degli anni Novanta. Arrestato sul confine con la Liberia, finisce in carcere dove incontra Solomon Vandy, un pescatore separato dalla sua famiglia dopo la feroce irruzione dei ribelli del Fronte rivoluzionario nel suo villaggio. Indicato pubblicamente per avere nascosto un diamante di grande caratura, Solomon accende l’interesse di Archer. In cambio della libertà e della promessa di ritrovare la sua famiglia, finita in un campo profughi dove si sono raccolte oltre un milione di persone, Solomon decide di condurre Archer al diamante. Con l’aiuto di Maddy Bowen, una giornalista idealista e appassionata, i due uomini intraprendono un viaggio alla ricerca di un bene più prezioso.",7.8,"['Netflix', 'Sky Go', 'Now TV']"
39,La dea fortuna,2019,"Alessandro e Arturo sono una coppia da più di quindici anni. Nonostante la passione e l’amore si siano trasformati in un affetto importante, la loro relazione è in crisi da tempo. L’improvviso arrivo nelle loro vite di due bambini lasciatigli in custodia per qualche giorno dalla migliore amica di Alessandro, potrebbe però dare un’insperata svolta alla loro stanca routine. La soluzione sarà un gesto folle. Ma d’altronde l’amore è uno stato di piacevole follia.",7.0,"['Now TV', 'Infinity', 'Infinity Selection Amazon Channel']"
40,Everest,2015,"Ispirato da una serie di incredibili eventi accaduti durante una pericolosa spedizione volta a raggiungere la vetta della montagna più alta del mondo, EVEREST documenta le avversità del viaggio di due diverse spedizioni sfidate oltre i loro limiti da una delle più feroci tempeste di neve mai affrontate dall'uomo. Il loro coraggio sarà messo a dura prova dal più crudele dei quattro elementi, gli scalatori dovranno fronteggiare ostacoli al limite dell'impossibile come l'ossessione di una vita intera che si trasforma in una lotta mozzafiato per la sopravvivenza.",7.0,"['Netflix', 'Now TV']"
41,Night Soil - Economy of Love,2016,"Economy of Love centres on a Brooklyn-based women’s activist movement that approaches sex work as a way for women to reclaim their power in a male-dominated pleasure zone. Their emphasis is on nurturing, educating and empowering both sexes around the power that lays within the female orgasm, advocating for a shifting vocabulary around sex work and gender roles and moving toward mutual respect and understanding of the body and spirit. —Tate Modern",,[]
42,Anno 2053 - La grande fuga,1991,"Il film è ambientato in Nord America nel 2053 d.C. nello stato della Federazione Occidentale. I pochi sopravvissuti ad uno sconvolgimento ambientale causato dall'uomo vivono in radi raggruppamenti sparsi in lande desolate a perdita d'occhio. L'ambiente è reso ostile dai raggi solari che, ormai nocivi, rendono impossibile ogni miglioramento ambientale. Il territorio fuori da ogni controllo è abitato da reietti, delinquenti e cacciatori di taglie. Il protagonista Stark (Ironside) ha catturato una pericolosa criminale che insegue da tempo, Reno (Vanity), salvandola dalla morte per l’aggressione di un teppista del deserto.",5.0,[]
43,Prima ti sposo poi ti rovino,2003,"La bella Marylin Rexroth è la classica mangiatrice d'uomini. Infatti, non appena ottenuto il divorzio dal facoltoso e donnaiolo marito Rex Rexroth, si mette alla ricerca di un nuovo ""pollo da spennare"". La preda prescelta questa volta è il più celebre tra i divorzisti di Los Angeles nonché avvocato dell'ex marito, l'affascinante Miles Massey. Riuscirà la bella Marylin ad intrappolare il sicuro, e all'apparenza pieno di sé, Miles?",6.1,"['Netflix', 'Sky Go', 'Now TV']"
44,Cattivissimo me 3,2017,"Gru, Margo, Edith e Agnes tornano per una serie di esilaranti avventure in Cattivissimo Me 3, il terzo film della serie di successo creata da Chris Meledandri. Dopo il matrimonio con Lucy Wilde, Gru dovà affrontare un nuovo cattivissimo nemico, Balthazar Bratt, un ex bambino prodigio cresciuto diventando ossessionato dal personaggio che ha interpretato negli anni 80, il quale si dimostrerà essere il nemico più temibile che Gru abbia mai incontrato.",6.3,[]
