,title,year,text,rating,providers
1075,Willful Infringement,2003,"Star Wars fans, party clowns, scientists, a Rolling Stones tribute band, a private detective, teachers, artists, DJ's, magazine editors, top legal scholars, FBI agents, corporate litigators and many more tell an ""extraordinary"" tale about how ownership of ideas has come into conflict with free expression. ""Willful Infringement"", which premiered 2003 at the San Francisco Museum of Modern Art, has been acclaimed as an entertaining, surprising and sometime shocking report from the front lines of intellectual property. This movie has screened at the Andy Warhol Museum in Pittsburgh, the Seattle Art Museum, the Franklin Institute of Science in Philadelphia, at the 17th Leeds International Film Festival, and at numerous universities, law schools and cultural events.",,[]
1076,Deceit,2006,A man returns to his hometown after his father's death and soon enters into an affair with the wife of his old best friend.,4.3,[]
1077,I Love Radio Rock,2009,"Nel 1966 - il periodo più straordinario per il pop britannico - la BBC trasmetteva solo 2 ore di rock and roll alla settimana. Ma una radio privata trasmetteva musica rock e pop, da una nave al largo della Gran Bretagna, 24 ore al giorno. E 25 milioni di persone - più di metà della popolazione britannica - ascoltava questi pirati ogni giorno. Dopo essere stato espulso da scuola, Carl (Tom Sturridge) viene spedito dalla sua ricca madre, frequentatrice dei salotti alla moda, presso il suo padrino Quentin (Bill Nighy), con la speranza che capisca ciò che vuole fare nella vita. Ma Quentin è il capo di Radio Rock, una radio libera pirata che trasmette da una nave nel bel mezzo del Mare del Nord, con a bordo un eclettico equipaggio di DJ di rock 'n' roll. Ma la radio pirata ha attirato l'attenzione del Ministro Dormandy (Kenneth Branagh) che da la caccia a questi fuorilegge.",7.3,"['Sky Go', 'Now TV']"
1078,Benvenuti a Zombieland,2009,"Il mondo è stato già invaso dagli zombie, la popolazione è stata già quasi totalmente decimata se non ridotta in stato di morto vivente e i pochi superstiti faticano a rimanere tali. Columbus in particolare ha messo a punto una serie di regole da seguire scrupolosamente che sembrano mantenerlo in vita nonostante l'aspetto non certo da uomo d'azione. Chi invece con l'azione ci va a nozze è Tallhassee (tutti quanti si chiamano con il nome della città di provenienza come in guerra), cowboy fuori dal tempo esaltato dall'atmosfera da fine del mondo e fiero massacratore di zombie. Sul loro percorso verso un ovest presumibilmente libero da zombie troveranno Little Rock e Wichita, due sorelle tutt'altro che indifese anch'esse allo sbando.",7.4,['Netflix']
1079,Il labirinto del fauno,2006,"Spagna 1944. Durante l'avanzata di Franco la giovane vedova Carmen raggiunge il nuovo compagno Vidal, capitano dell'esercito, con la figlia dodicenne Ofelia. La bambina, che non ama il nuovo patrigno, per sfuggire alla difficile situazione si rifugia in un mondo di fiabe che si materializza con la presenza di un fauno inviato a rivelarle la sua vera identità, quella di principessa di un regno sotterraneo.",8.0,"['Sky Go', 'Now TV']"
1080,Apart from That,2006,"Ulla rents a room in Peggy's home, and they don't talk much. They have very little in common, so it seems; Ulla is an introverted student beautician who drives a Buick that doesn't belong to her, while Peggy has become too old to keep her driver's license and too lonely to care about her own reputation. In want of company, Peggy makes emergency phone calls to local fire departments, and when there is no fire to put out, she offers coffee and nudity in consolation. Meanwhile, when Ulla is recruited into an intervention for a fellow classmate of hers-someone whom she hardly knows - she is thrown into a new set of circumstances that derails her role as a guest in a foreign home full of sound and silence. Leo, a Native American road striper for the department of transportation, remains haunted by something he can't talk about. While all of his co-workers come to him with their constant litany of everyday dilemmas...",5.6,[]
1081,Mission: Impossible - Fallout,2018,"Ethan Hunt riceve a Belfast l'ordine di una nuova missione impossibile: recuperare una valigia di plutonio e scovare i cattivissimi che immancabilmente vogliono metterci le mani sopra. Sulle tracce di John Lark, il misterioso finanziatore del rapimento di uno scienziato anarchico ed esperto in armi nucleari, ritrova a Berlino i compagni di sempre: Benji e Luther, a cui salva la pelle compromettendo la missione. E adesso tocca riparare, lanciandosi sul cielo di Parigi per (s)mascherare Lark e incontrare la Vedova Bianca, un'intermediaria sexy e letale. Come a ogni missione, niente andrà come previsto.",7.5,['Netflix']
1082,Al Petteway: Celtic Blues & Beyond,2004,"Top-selling guitarist Al Petteway does something few other musicians attempt: He mixes instrumental styles from folk to Celtic blues and makes them seem as natural as taking a deep breath. Songs included are ""Eureka Hotel,"" ""Meant to Be,"" ""She Moved Through the Fair,"" ""Smoky Mountain Morning,"" ""Spindrift,"" ""The West Wind"" and more. Special features include instructional multi-camera angles for close-up viewing of Petteway's hands.",,[]
1083,Simply Red: Farewell,2011,"Registrato al Sydney Opera House nel mese di ottobre 2010 durante Simply Red tour di addio del 2009-2010, il nome appropriato Farewell è un CD / DVD insieme che cattura Mick Hucknall, in fine, forma nostalgica. Non ci sono sorprese, sia nella selezione del brano o della sua band approccio liscio impeccabile, ma il comfort è il punto di tutta la vicenda: è ​​l'ultima possibilità per i fan di ascoltare quelle canzoni di nuovo.",7.1,[]
1084,Vulcan,1997,"When a dinosaur egg is unearthed by a powerful volcano, a little boy's life is changed forever. The pterodactyl named ""Vulcan"", and the little boy end up forming an unbreakable bond of friendship while on an amazing spree of adventures.",4.5,[]
1085,Back to Normandy,2007,A filmmaker returns to Normandy thirty years after a working on a movie based on a local homicide and tries to find the actors who worked on the project.,5.7,[]
1086,Scrivimi una canzone,2007,"Ad Alex Fletcher, una popstar degli anni '80 ormai in declino, viene proposta un'occasione irrinunciabile: scrivere una canzone per Cora Corman, l'idolo del momento, e cantarla insieme a lei. Il sogno di un ritorno dignitoso sulle scene - dopo anni di esibizioni in alberghi e luna park di fronte a un pubblico di donne tutte grida e nostalgia - si smaterializza quando viene a sapere che il tempo a disposizione è risicato. Alex non è mai stato bravo con le parole e non scrive un brano da quindici anni. Proprio quando pensa di non potercela fare scopre che Sophie Fisher - una bizzarra annaffiatrice-supplente che gli entra in casa come un tornado - ha un dono particolare per le rime e la convince ad aiutarlo. Gli sforzi dei due daranno vita alla canzone ""Way Back Into Love"", che li guiderà sulla strada dell'amore.",6.4,[]
1087,Sandcastle,2010,"En is an 18-year-old who has lost his father to cancer. As his family is drawn together in a sudden tragedy, he has to decide what he believes in. But in a country where ideologies are forged on constantly shifting sands, he struggles to stay true to what he knows to be right. And in a family that prefers to forget, the sandcastles of all he holds dear seem doomed to be washed away by the tides of time.",5.8,[]
1088,Una notte da leoni,2009,"Doug, Phil, Stu e Alan sono un gruppo di amici che, all'annuncio del matrimonio di Doug, decidono di organizzare una festa di addio al celibato a Las Vegas. Phil e Stu sono amici d' infanzia dello sposo: uno è un sereno insegnante delle elementari, mentre l'altro è un dentista, convivente con una gelosa quanto atroce compagna; Alan è invece lo stravagante fratello della promessa sposa di Doug ed accetta di partecipare una volta invitato dal cognato.Giunti a Las Vegas i quattro si recano sul tetto dell'albergo in cui risiedono e una volta qui iniziano a bere in onore della loro amicizia. Il mattino seguente gli amici si svegliano intontiti e privi di ricordi della sera precedente e dopo aver riacquistato un minimo di lucidità si accorgono che la stanza dell'hotel è totalmente sottosopra e che il loro amico Doug, lo sposo, è scomparso nel nulla.",7.5,['Netflix']
1089,Ocean's Eleven - Fate il vostro gioco,2001,"L'incasso di tre casinò di Las Vegas converge in un unico caveau. Si tratta, nell'occasione, di 163 milioni di dollari. È a questi che mira Ocean, uscito di prigione. Organizza il colpo insieme a un suo amico. Vengono reclutati specialisti in ogni campo, i più bravi. I Casinò appartengono a un unico proprietario, certo Tony Benedict, straorganizzato e, al caso, crudelissimo. Veniamo anche a sapere che Tess, ex moglie di Ocean (ma lui è sempre innamoratissimo) sta proprio con Benedict. Per Ocean sarebbe dunque una doppia vendetta. La rapina riesce: supertecnologica. E anche la riconciliazione fra Tess e Ocean riesce.",7.6,['Netflix']
1090,Women in Film,2001,"Three women in Hollywood talk to the camera one summer (with a coda six months later). Sara is a casting director; her soliloquies are addressed to Samson (her blind infant son) and to Holly Hunter. She talks about her husband's refusal to touch their son and her discovery of his affair. Gina is a masseuse - blithe, solipsistic, scheming to steal the energy of Hollywood players. She frequently refers to her dead sister Wanda, kidnaped by their father. Phyllis, sexually abused by her father when a teen, addresses her son Eric. She's a producer, working on remaking Pasolini's ""Teorema."" As the project falls apart, so does she. All three hum or sing, ""You made me love you.""",4.7,[]
1091,Un giorno di pioggia a New York,2019,"Una giovane coppia, per ragioni di lavoro, deve trascorrere a Manhattan un piovoso fine settimana, ma il loro legame sarà messo alla prova. Lei inizia infatti una relazione con un celebre regista che deve intervistare, mentre lui con una ragazza con cui recita in un film.",6.5,['Rai Play']
1092,Ms. Marvel,2022,"Grande studentessa, accanita giocatrice e vorace scrittrice di fan-fiction, Kamala Khan ha un'affinità speciale per i Supereroi, in particolare Captain Marvel. Tuttavia, lotta per adattarsi a casa e a scuola, fino a quando non ottiene i superpoteri come gli eroi a cui ha sempre ammirato. La vita è più facile con i superpoteri, giusto?",6.6,['Disney Plus']
1093,Confession of Pain - L'ombra del passato,2006,"Hei e Bong sono stati compagni in polizia: Hei è ancora in servizio, mentre Bong si è ritirato ed ora è un investigatore privato. I due uomini si ritroveranno a lavorare ancora una volta fianco a fianco per risolvere un misterioso caso di omicidio ai danni del suocero di Hei. Le indagini avvicineranno sempre più i due uomini ma allo stesso tempo faranno emergere sconvolgenti verità.",6.4,['Chili']
1094,El Cortez,2006,"Un uomo appena rilasciato da un istituo psichiatrico viene coinvolto in un piano criminoso e allo stesso tempo è costretto a tenere a bada la polizia, uno spacciatore vendicativo e una pericolosa femme fatale.",5.4,[]
1095,Ceneri alle ceneri - Pumpkinhead 3,2010,"Ha gettato i loro cari in una palude. Ora vogliono vendetta... Ma quando un demone fa il suo lavoro sporco, ha un prezzo.",4.8,[]
1096,"All Blossoms Again: Pedro Costa, Director",2006,"With this movie, Aurélien Gerbault invites us to know the portuguese filmmaker Pedro Costa and to witness the process of shooting of his movie Colossal Youth (2006). The nature of Costa's cinema is revealed to us: the criation of an intimate space in the hardness of reality.",7.5,[]
1097,Die Copiloten,2007,The popular Munich crime scene duo Nemec and Wachtveitl give absolutely nothing in this comedic treat.Lothar likes his life as a commercial photographer. His best friend Milan flies around the world as a co-pilot. Everything is fine until Lothar starts an affair with Milan's daughter and Milan consoles himself with Lothar's girlfriend. From now on it's all fun. The harmonious coexistence in two semi-detached houses becomes a make or break fight.,5.1,[]
1098,Rosamunde Pilcher: Cuori nel vento,2008,"On the way to the church to marry Sophie of Winterston (Luise Bähr) runs over a motorist who crosses at her bridal car. Fate makes poor man is a former boyfriend who left she to go to Africa and who has not seen for years. This coincidence makes Sophie rethink her life and let was going to be her future husband at the altar ... Adapted from the novel by Rosamunde Pilcher, Scottish writer whose works have been brought to the small screen since 1993.",4.0,[]
1099,Hook N Shoot Revolution 4,2008,"Hook N Shoot has established itself as the building block for the sport of women's MMA (Mixed Martial Art). It has launched the careers of some of the best female fighters in the industry and is on a relentless quest to find the ""next top fighter"".
 The 4th edition of the ""Revolution"" series has the established stars and brand new athletes. If you haven't seen women's MMA, get ready to be entertained.  THE FIGHTS:
 Sally Krumdiak -vs- Jessica Penne
 Kelli Salone -vs- Dina Van Den Hooven
 Julie Kedzie -vs- Sasha Mirvic
 Victoria Remington -vs- Molly Helsel
 O.D.B. -vs- Kelly Kobold
 Tara LaRosa -vs- Ginele Marquez
 Shelby Walker -vs- A.J. Jenkins
 Shelby Walker -vs- Angela Wilson",,[]
1100,You're the One,2000,"Julia, an only child of an affluent, bank owning family living in Madrid, escapes from her family to get over her grief that her boyfriend has been imprisoned. Julia is a well educated woman, having studied in Switzerland and England, who wants to become a writer. Julia drives to a little village in Asturias called ""Corralbos del Sella"" and there she stays in a mansion ""llendelabarca"" of an old childhood friend ""Pilara"" she had spent many a happy summer with. Also living there is Pilara's mother in law Tia Gala, and her grandson Juanito. Julia's relationship with caretakers, teacher and priest makes Julia, a woman of the spanish capital, perhaps for the first time to not feel so alone.",7.1,[]
1101,Cena con delitto - Knives Out,2019,"Quando il noto scrittore di gialli Harlan Thrombey viene trovato morto nella sua tenuta poco dopo il suo 85° compleanno, il detective Benoit Blanc, curioso e disinvolto, viene misteriosamente reclutato per investigare sull'accaduto. Dalla disfunzionale famiglia della vittima al suo devoto entourage, Blanc si muove attraverso una fitta rete di bugie, segreti e non detti, per scoprire quale sia la verità dietro la prematura morte dell'autore.",7.9,"['Netflix', 'Sky Go', 'Now TV', 'Timvision', 'Infinity', 'Amazon Prime Video', 'Infinity Selection Amazon Channel']"
1102,The Adopted Son,1998,"In a Kyrgyz village, five older women adopt an infant foundling. Jump ahead about 12 years: the boy, Beshkempir, is entering puberty, the age, his granny says, when life goes berserk. He plays with friends, horsing around, sniggering about sex, going to an outdoor movie. He works, fishing and making bricks of mud. And, he's starting to notice girls. He and his best friend fight, and he learns to his consternation that he's a foundling. A death in the family pushes Beshkempir even faster toward adult roles: he must brush tears from his eyes, lead a funeral procession, and reconcile with his friend. Then, he borrows a bicycle and calls on Aynura: courtship begins.",6.3,[]
1103,DC League of Super-Pets,2022,"Con la Justice League catturata da Lex Luthor, Krypto, il cane di Superman, forma una squadra di animali domestici a cui sono stati assegnati dei super poteri. Tra i componenti, ci sono un segugio di nome Ace (dotato di super forza), un maiale di nome PB (che può diventare di spaventose dimensioni), una tartaruga di nome Menton (che ha il dono della super velocità) e uno scoiattolo di nome Chip (che acquisisce poteri elettrici).",7.5,[]
1104,Kuka,2007,A woman and a young girl in different cities are struggling to find their way in this world. Will their paths intersect and will that change their destinies?,7.1,[]
1105,eXistenZ,1999,"eXistenZ, un gioco basato su tecnologie avanzate ideato dai dirigenti della Antenna Research, ha ottenuto un grande successo di pubblico. Dietro il gioco si cela l'ingegno di Allegra Geller, una donna determinata e attraente. Ciò che rende eXistenZ così reale è il fatto che il dispositivo che lo aziona, il game pod, si inserisce direttamente nel sistema nervoso del giocatore tramite un connettore spinale. Ma delle forze anti eXistenZ, che sulla testa di Allegra hanno messo una taglia, sabotano il gioco.",6.8,['Timvision']
1106,Magnolia,1999,"Gli ultimi giorni della vita del ricco Earl Partridge significano cambiamenti e confronti, non solo per il moribondo, ma anche per altre otto persone che si trovano d'improvviso a fare i conti con colpe e sentimenti nella San Fernando Valley, in California.",7.8,"['Sky Go', 'Now TV', 'Amazon Prime Video']"
1107,...E alla fine arriva Polly,2004,"Reuben Feffer è un uomo mite, che non ama i rischi e gli estremi. Rimane calmo anche quando i suoi sogni di tranquillità sono scossi dal tradimento della moglie in piena luna di miele. Ma tutto cambierà dal momento in cui si ripresenta nella sua vita la vecchia amica d'infanzia Polly.",6.0,"['Netflix', 'Sky Go', 'Now TV']"
1108,Watcher,2022,"Una giovane donna si trasferisce con il fidanzato in un nuovo appartamento. Ben presto, ha come la sensazione di essere perseguitata da qualcuno che, in maniera invisibile, la spia dall'edificio adiacente.",6.2,[]
1109,Brain Fear Gone,2000,"Jon Elliott, Omar Wysong, Brian Shima, Dustin Latimer and Aaron Feinberg star in this timeless rollerblading classic from Mindgame.",,[]
1110,Finché morte non ci separi,2019,"La notte di nozze di una giovane sposa prende una svolta sinistra quando la sua nuova, eccentrica famiglia acquisita la costringe a prendere parte a un gioco terrificante.",6.9,['Disney Plus']
1111,Irréversible,2002,Alex viene violentata e massacrata a suon di botte da uno sconosciuto in un sottopassaggio della metropolitana. Il suo attuale compagno Marcus e il suo ex amico Pierre decidono di vendicarsi dell'uomo responsabile della barbarie subita dalla donna.,7.3,[]
1112,Hong Kong Express,1994,"Opera del 1994, Hong Kong Express è diviso in due episodi: i protagonisti sono due poliziotti (che nel film vengono indicati con i numeri 223 e 663), entrambi reduci dalla fine di un rapporto d'amore, e ancora non rassegnati a continuare la loro vita. E' un film molto delicato, che ci introduce nella vicenda gradatamente, presentandoci prima gli effetti e poi le cause. Girato in poco più di tre mesi, facendo larghissimo uso della camera a mano, con stile più da videoclip musicale che da film classico e un budget ridottissimo, offre diversi spunti interessanti tanto nei contenuti e nel modo con il quale vengono presentati allo spettatore, che nella tecnica. La regia è sicura, vivace nonostante i frequentissimi cambi di scena, o le lunghe inquadrature ""sulla tristezza"" dei personaggi.",8.0,"['Mubi', 'Mubi Amazon Channel']"
1113,Con chi viaggi,2022,"Quattro sconosciuti si incontrano grazie ad una app per condividere un viaggio in auto. Tutto sembra scorrere normalmente ma, come spesso accade, la realtà non è quella che sembra.  Paolo (Lillo) è un irrequieto uomo dall’aspetto simpatico che sembra nascondere qualcosa. Michele (Fabio Rovazzi) e Anna (Alessandra Mastronardi) nascondono di aver avuto un passato insieme. Elisa (Michela De Rossi) non sa di avere con Paolo un rapporto decisamente speciale.",5.5,"['Now TV', 'Amazon Prime Video']"
1114,Volo 7500,2014,"Il 12 maggio il volo 7500 della Vista Pacific decolla dall'aeroporto internazionale di Los Angeles con destinazione Tokyo. Le prime ore di volo procedono regolarmente ma le restanti si trasformeranno in un incubo senza fine. Non appena cala la notte, mentre l'aereo si fa strada sull'oceano Pacifico, i passeggeri a bordo si ritrovano faccia a faccia con quella che sembra essere una forza innaturale e non umana.",4.8,[]
1115,Black Phone,2022,"Finney Shaw, un timido ma intelligente ragazzo di 13 anni, viene rapito da un sadico assassino che lo rinchiude in un seminterrato insonorizzato dove le urla servono a poco. Quando un telefono disconnesso inizia a squillare sul muro, Finney scopre di poter sentire le voci delle precedenti vittime dell’assassino. E sono decisi a fare in modo che ciò che è successo a loro non accada a Finney.",7.5,[]
1116,Kill Bill: Volume 1,2003,"La Sposa è una ex-killer che faceva parte dei 'Deadly Viper Assassination Squad'. Aggredita e quasi uccisa il giorno delle nozze per ordine del suo padrino Bill, la Sposa entra in coma. Dopo cinque anni, però, si risveglia. Addestrata dai monaci Shaolin allo Zen e alle arti del Kung Fu, diventa una macchina di morte con una sola missione: uccidere Bill.",8.1,"['Timvision', 'Infinity', 'Infinity Selection Amazon Channel']"
1117,Millennium - Uomini che odiano le donne,2011,"Mikael Blomkvist è un giornalista celebre per il suo impegno e per una condanna di diffamazione, collezionata dopo aver attentato alla reputazione di un infido uomo d'affari. La sua scrupolosità zelante e il suo recente rovescio gli attirano le simpatie di Henrik Vanger, potente industriale svedese che da quarant'anni cerca la verità e il corpo della giovane nipote, probabilmente assassinata da un membro della sua numerosa e disturbata famiglia. Lasciata Stoccolma alla volta di Hedestad, una cittadina battuta dal vento e assediata dall'inverno, Mikael si avvale della collaborazione di Lisbeth Salander, agente investigativo intuitiva e hacker virtuosa con un passato abusato e un presente intimidito. Selvatica e bellicosa Lisbeth è attratta dalla riservatezza e dall'integrità di Mikael, che seduce, corteggia e prova a innamorare. Fuori dal letto e dalla loro intesa intanto i fantasmi del passato si risvegliano e provano a ostacolarne l'indagine e a minacciarne la vita.",7.6,['Amazon Prime Video']
1118,Nome in codice: Imperatore,2022,"Segue Juan, un agente che lavora per i servizi di intelligence, che fa capo anche a un'unità parallela coinvolta in attività illegali.",5.8,['Netflix']
1119,Spider-Man: Far from Home,2019,"Peter Parker ritorna in Spider-Man: Far From Home, il secondo capitolo della serie di Spider-Man: Homecoming! Il nostro amichevole Spider-Man di quartiere decide di partire per una vacanza in Europa con i suoi migliori amici. I propositi di Peter di non indossare i panni del supereroe per alcune settimane vengono meno quando decide, a malincuore, di aiutare Nick Fury a svelare il mistero degli attacchi di creature elementali che stanno creando scompiglio in tutto il continente.  Parte delle riprese sono state realizzate a Venezia tra settembre e ottobre 2018.",7.4,[]
1120,I morti non muoiono,2019,"In una piccola e tranquilla cittadina, gli zombie si alzano improvvisamente per terrorizzare la città. Ora tre poliziotti con gli occhiali e uno strano esperto scozzese dell'obitorio devono unirsi per sconfiggere i non morti.",5.4,['Netflix']
1121,Dogville,2003,"Stati Uniti, inizio anni Trenta del secolo scorso. Una giovane ed affascinante donna in fuga arriva in un piccolo centro di provincia. Di lì a poco la sua presenza sconvolgerà la tranquilla esistenza della comunità locale.",7.9,[]
1122,Space Jam,1996,"Sul Pianeta dei Nerdlucks, il lunapark elettronico sta per fallire per mancanza di nuovi divertimenti. Alla ricerca di soluzioni per rimettere in sesto la situazione, Swackhammer, padrone del lunapark e capo dei Nerdlucks, invia un gruppo sulla Terra con il compito di rapire i Loony Tunes e carpire i segreti dei loro divertimenti. I Nerdlucks stanno per avere la meglio, quando Bugs Bunny ha un'idea: sfida gli avversari ad una partita di basket, se i Tunes vinceranno, potranno rimanere sulla Terra; se perderanno dovranno seguire i nemici sul loro Pianeta.",6.7,[]
1123,Halloween - The Beginning,2007,"Madre spogliarellista e padre alcolizzato Mike Myers, dodicenne, massacra la famiglia la notte di Halloween, finisce in manicomio, dopo diciassette anni scappa e si fionda alla ricerca della sorellina minore, per proteggerla, forse, uccidendo famiglie e giovani studentesse.",6.1,"['Netflix', 'Amazon Prime Video']"
1124,Bones and All,2022,"Il film racconta la storia di un primo amore, quello che porta Maren, una giovane donna che impara a sopravvivere ai margini della società, e Lee, un reietto vagabondo dall’animo combattivo, a unirsi e intraprendere un’odissea di centinaia di chilometri nell'America di Ronald Reagan, tra botole, passaggi segreti e stradine di provincia. Tuttavia, per quanto si sforzino, qualunque strada sembra riportarli al loro tremendo passato, fino al momento finale che deciderà se il loro amore sia realmente in grado di sopravvivere al loro essere altro rispetto al mondo che li circonda.",6.7,[]
