,title,year,text,rating,providers
717,Khauff,2000,"While returning home from the marriage of her friend, Ritu Pereira, Neha Verma, an air hostess, witnesses the brutal death of Superintendent of Police Jaidev Singh,...",4.8,[]
718,X - A Sexy Horror Story,2022,"Nel 1979, una troupe di ragazzi ambiziosi e affamati di successo decide di girare un film per adulti nelle zone rurali del Texas, ma l’anziana coppia che la ospita, in una fattoria isolata e indisturbata, comincia a nutrire un interesse lascivo per i giovani attori. Durante la notte, questo interesse morboso esploderà in tutta la sua violenza e terrore.",6.7,[]
719,Thor: Ragnarok,2017,"Thor è imprigionato dall’altro lato dell’universo senza il suo potente martello e deve lottare contro il tempo per tornare ad Asgard e fermare il Ragnarok — la distruzione del suo mondo e la fine della civiltà asgardiana — per mano di una nuova e onnipotente minaccia, la spietata Hela. Ma prima dovrà sopravvivere a un letale scontro fra gladiatori che lo metterà contro il suo vecchio alleato e compagno nel team degli Avengers: l’Incredibile Hulk.",7.8,['Disney Plus']
720,Strade Perdute,1997,"Fred Madison è un musicista sposato ad una splendida dark lady; il sospetto che la moglie lo tradisca lo induce a perdere la fiducia in se stesso e in lei, fino a trascinarlo in una spirale di follia e violenza inaudite...",7.6,"['Pluto TV', 'VVVVID']"
721,Se mi lasci ti cancello,2004,"Joel e Clementine sono una coppia molto innamorata. Un giorno però, la ragazza, stanca della sua relazione ormai in fase di declino, decide, mediante un esperimento scientifico, di farsi asportare dalla mente la parte relativa alla storia con Joel. Il giovane, una volta venuto a conoscenza di questo fatto, sceglie di fare altrettanto ma durante il procedimento cambia idea.",8.2,"['Sky Go', 'Now TV']"
722,L'uomo della pioggia,1997,"Rudy Baylor, giovane laureato in giurisprudenza, aspira a diventare un ""uomo della pioggia"", vale a dire, un uomo destinato ad arricchire lo studio legale che avrà la fortuna di assumerlo. L'avvocato entra così in contatto con personaggi di dubbia fama. Un giorno si troverà a dover sfidare una assicurazione potente e corrotta che, attraverso un raggiro assicurativo da milioni di dollari, si è arricchita ai danni dei lavoratori.",7.1,['Netflix']
723,Uno di famiglia,2018,"Luca (Pietro Sermonti), quarantatreenne mite e sornione, sbarca il lunario insegnando dizione. Un giorno, per caso, salva la vita al suo allievo Mario (Moisè Curia), un giovane desideroso di fare l’attore a cui va corretta l’inflessione dialettale. Ad insaputa di Luca però, il ragazzo è il rampollo di una potente famiglia malavitosa calabrese: i serranò, ora in debito con lui!  Come un fulmine a ciel sereno nella sua vita e in quella della fidanzata Regina (Sarah Felberbaum), irrompono la spietata Zia Angela detta “Della Morte” (Lucia Ocone) ed il capo “fammigghia” Peppino Serranò (Nino Frassica)… l’uomo a cui nessuno può dire di no!  Fraintendimenti e avvenimenti tragicomici si susseguiranno nella storia coinvolgendo amici, conoscenti e nemici di Luca… ognuno a suo modo se la vedrà con i vari componenti del colorito nucleo malavitoso… perché non sempre è un vantaggio essere “uno di famiglia”.",5.8,"['Infinity', 'Infinity Selection Amazon Channel']"
724,Tutto può cambiare,2013,"Dan Mulligan, produttore musicale in caduta libera, con una figlia adolescente, un matrimonio fallito alle spalle e il vizio della bottiglia, incontra Gretta, una cantautrice inglese in panne sulla banchina della metropolitana. Arrivata a New York col fidanzato quasi celebre e la promessa di una vita da spendere insieme, Gretta perde in un baleno ragazzo e sogni. Autrice di ballate sentimentali, una sera si esibisce suo malgrado in un locale dell'East Village frequentato da Dan. Ubriaco di sventura ma avvinto dalla sua musica, Dan le propone di lavorare insieme per riprendersi il loro posto nel mondo.",7.3,"['Sky Go', 'Now TV', 'Timvision', 'Mediaset Play']"
725,Hustle,2022,"L'allenatore di una squadra di basket scopre un giocatore con un passato tumultuoso che gli sembra un fenomeno e che decide di prendere sotto la propria ala, nonostante la disapprovazione di tutti gli altri. Riportarlo sul campo sarà una sfida con tutti.",7.6,['Netflix']
726,Il bambino con il pigiama a righe,2008,"Berlino, anni Quaranta. Bruno è un bambino di otto anni con larghi occhi chiari e una passione sconfinata per l'avventura, che divora nei suoi romanzi e condivide coi compagni di scuola. Il padre di Bruno, ufficiale nazista, viene promosso e trasferito con la famiglia in campagna. La nuova residenza è ubicata a poca distanza da un campo di concentramento in cui si pratica l'eliminazione sistematica degli ebrei. Bruno, costretto ad una noiosa e solitaria cattività dentro il giardino della villa, trova una via di fuga per esplorare il territorio. Oltre il bosco e al di là di una barriera di filo spinato elettrificato incontra Shmuel, un bambino ebreo affamato di cibo e di affetto. Sfidando l'autorità materna e l'odio insensato indotto dal padre e dal suo tutore, Bruno intenderà (soltanto) il suo cuore e supererà le recinzioni razziali.",7.8,['Timvision']
727,Disco,2017,Three estranged sisters go out to a local discotheque as a way to rebond after years of separation.,6.6,[]
728,Gattaca - La porta dell'universo,1997,"Nel prossimo futuro l'ingegneria genetica prenderà il sopravvento, distinguendo gli esseri umani in ""validi"", concepiti in provetta col DNA modificato, e ""non validi"", concepiti tradizionalmente. Così, Vincent Freeman, un non valido è costretto a falsificare la sua identità anagrafica per poter diventare un cosmonauta.",7.7,[]
729,La rivincita delle bionde,2001,"Elle Woods è una giovane viziata e biondissima ragazza, che vive seguendo le regole di Cosmopolitan, passando le sue giornate tra amiche e shopping, portando sempre con se il suo amato chihuahua Bruiser. Una sera il fidanzato Warner, dopo averla invita a cena, la lascia, perché la considera troppo frivola per poter stare accanto a lui, visto che sogna una carriera in politica. Inizialmente amareggiata, Elle non si arrende e con la sua carica di positività, decide di seguire Warner all'Università Harvard, studiando anche lei legge, per dimostrargli di non essere solo una superficiale bionda.",6.6,"['Netflix', 'MGM Amazon Channel']"
730,Hotel Splendide,2000,"The film tells the story of the Blanche family who run a dark and dismal health resort on a remote island which is only accessible by ferry. The spa program consists of feeding the guests seaweed and eel-based meals, then administering liberal colonic irrigation. The spa is run by the family matriarch Dame Blanche until her death. Things continue on with her children running the resort until Kath, the resort's former sous chef and love interest of one of the sons, comes back to the island unannounced. Stranded between monthly ferries, she is a catalyst for a series of events that turns life as it is known at Hotel Splendide on its ear.",6.0,[]
731,Terminator - Destino oscuro,2019,"Sarah Connor, ormai esperta cacciatrice di macchine, si ritrova a dover salvare una ragazza di nome Dani Ramos. A dare la caccia alla giovane è un nuovo modello di cyborg, inviato dal futuro da Skynet. La resistenza ha incaricato un'ibrida metà umana e metà cyborg di nome Grace, di proteggere Dani. Nonostante i geni potenziati di Grace e le svariate armi di Sarah, le due non riescono ad abbattere il temibile cyborg e l'unica via di salvezza sembra essere la fuga. Ma non si può scappare per sempre: le donne si vedono allora costrette a rivolgersi al ""vecchio"" modello di Terminator, il T-800, l'unico che può provare ad aiutarle a salvare non solo la giovane ma anche il futuro.",6.3,['Disney Plus']
732,Your Name.,2016,"Mitsuha è una studentessa che vive in una piccola città rurale e desidera trasferirsi a Tokyo, nella grande metropoli dove ogni sogno si può realizzare. Taki è uno studente di liceo che vive proprio a Tokyo, ha un lavoro part-time in un ristorante italiano, ma vorrebbe lavorare nel campo dell’arte o dell’architettura. Una notte, Mitsuha sogna di essere un giovane uomo, si ritrova in una stanza che non conosce, ha nuovi amici e lo skyline di Tokyo si apre dinnanzi al suo sguardo. Nello stesso momento Taki sogna di essere una ragazzina che vive in una piccola città di montagna che non ha mai visitato. Ma quale sarà il segreto che si cela dietro questi strani sogni incrociati?",8.5,[]
733,The Butterfly Effect,2004,"Evan soffre di amnesie fin da bambino. Mentre rilegge alcuni avvenimenti traumatici nei suoi diari, viene catapultato indietro nel passato, che presto scopre di poter influenzare. Cambiare anche il minimo dettaglio, però, sconvolge tutto il suo vissuto, e il destino di Evan e dei suoi amici, al risveglio, è completamente cambiato.",7.6,[]
734,Cosmopolis,2012,"E' la storia di un giovane manager multimiliardario, Eric Packer, che attraversa New York nella sua limousine, deciso ad andare nel suo vecchio quartiere per farsi tagliare i capelli. Nella sua auto superaccessoriata e computerizzata in costante contatto coi mercati azionari, l'uomo fa riunioni di affari, si sottopone ad approfondite visite mediche, ecc., costantemente protetto da guardie del corpo che sanno che uno stalker potrebbe ucciderlo. Packer entra ed esce dalla limousine per fare sesso con le sue amanti nei vari alberghi della città, e incontra in strane circostanze l'ereditiera che ha da poco sposato e i cui miliardi sta giocando e perdendo in borsa.",5.4,['Rai Play']
735,Fuoco cammina con me,1992,"Un agente dell'FBI scompare misteriosamente durante le indagini sulla morte di un'adolescente, Teresa Banks, avvenuto nei dintorni della cittadina di Twin Peaks. L'omicidio sembra essere collegato a quello di Laura Palmer, un'altra ragazza del luogo, invischiata in una serie di torbide vicende di sesso e droga. Il brillante investigatore Dale Cooper tenta di scovare l'assassino attraverso una serie di indizi che gli appaiono in sogno.",7.3,['VVVVID']
736,Fiore del deserto,2009,"La vera storia di Waris Dirie, che inizia nei deserti africani per finire nel mondo delle top model. All'età di 13 anni fugge dalla famiglia nomade per scampare ad un matrimonio forzato. Aiutata dalla nonna a Mogadiscio, viene inviata a Londra dove diventa una serva dell’Ambasciata Somala. Questo la esclude dall'apprendimento della lingua inglese. Si guadagnerà poi da vivere con lavori umili, finchè un giorno il fotografo Terry Donaldson la convince a posare. Waris, al culmine del suo successo, trova il coraggio di raccontare la sua storia.",7.4,"['Mediaset Play', 'CG Collection Amazon channel']"
737,Assassinio sul Nilo,2022,"Il detective Hercule Poirot è a bordo di un affascinante battello in crociera sul fiume Nilo, di cui sono ospiti anche due giovani in viaggio di nozze. L'atmosfera idilliaca, però, è infranta presto da morti violente e da una spasmodica ricerca dell'assassino.",6.5,['Disney Plus']
738,Un volto tra la folla,2008,Documentario italiano su Franco Gasparri.,,[]
739,Duct Wars: The Silver Enemy,2000,Juan Zi Nobie and Dantin have retired from active duty and are replaced by Christo and Katano. The Masked empire hires a freelance rogue to kill the ally Silver Alien and use his identity to wage war on the Ductorians,,[]
740,Ocean's Twelve,2004,"Sono passati tre anni da quando Danny Ocean e i suoi, lo specialista Rusty Ryan il promettente Linus Caldwell, l'esperto di esplosivi Basher Tarr e lo scassinatore Frank Catton, hanno messo a segno la rapina più audace e remunerativa della storia ai danni del proprietario di casino Terry Benedict, portando via anche l'ultimo centesimo dal suo caveau di Las Vegas. Dopo essersi divisi i 160 milioni di dollari di bottino, i membri della banda hanno cercato di filare dritto, di vivere onestamente ma purtroppo non è facile, con grande dispiacere di Tess, moglie di Danny. Quando qualcuno infrange la Regola Numero Uno e li denuncia a Benedict, non ci sono alternative, devono restituirgli i 160 milioni di dollari, con gli interessi, o peggio per loro. E, come la banda scopre rapidamente, Benedict non è l'unico sulle loro tracce...",6.5,['Netflix']
741,Mario Bava: Maestro of the Macabre,2000,"Director Garry S. Grant’s insightful documentary celebrates the work and legacy of auteur filmmaker Mario Bava, the grand master of Italian horror and the man known by many as “the Italian Hitchcock.”",6.3,[]
742,Prisoners of the Sun,1992,Tintin and Captain Haddock travel to Peru in search of an abducted friend.,6.9,[]
743,Patagonia 3D - In the Footsteps of Charles Darwin,2012,"Patagonia. A country full of endless expanse of untouched nature. A unique wildlife awaits us here at the end of the world, where only a select few get there. Based on original quotations from his travelogue, the film follows the historic route of one of the most important nature observers and evolutionary scientists of history - Charles Darwin. The courses alternate shots from fascinating animal with breathtaking scenery. Follow us on this adventure and experience firsthand the beauty and fascination of the most unique landscapes on earth - in 3D.",8.0,[]
744,Supereroi,2021,"Lei è una fumettista dal carattere impulsivo, nemica delle convenzioni; lui un professore di fisica convinto che ogni fenomeno abbia la sua spiegazione. A tenerli insieme è un’incognita che nessuna formula può svelare.",6.9,['Amazon Prime Video']
745,Making the Earth Stand Still,1995,"A documentary about the 1951 sci-fi film ""The Day the Earth Stood Still,"" featuring clips from the film and interviews with some of the cast and crew about the making of the film.",7.0,[]
746,La 25ª ora,2002,"Monty Brogan è uno spacciatore di droga, fidanzato con Naturelle, una ragazza portoricana. I suoi migliori amici sono Jacob, un insegnante innamorato di una sua studentessa, e Frank, un agente di borsa. Monty ha anche un cane, con il quale passeggia per le strade di New York. Il padre, James, è un vigile del fuoco in pensione che pensa ai colleghi uccisi l'11 settembre.",7.5,['Disney Plus']
747,Ready Player One,2018,"Nel 2045, anno in cui il mondo sta per collassare sull’orlo del caos, le persone hanno trovato la salvezza nell’OASIS, un enorme universo di realtà virtuale creato dal brillante ed eccentrico James Halliday. A seguito della morte di Halliday, la sua immensa fortuna andrà in dote a colui che per primo troverà un Easter egg nascosto da qualche parte all’interno dell’OASIS, dando il via ad una gara che coinvolgerà il mondo intero. Quando un improbabile giovane eroe di nome Wade Watts deciderà di prendere parte alla gara, verrà coinvolto in una vertiginosa caccia al tesoro in questo fantastico universo fatto di misteri, scoperte sensazionali e pericoli.",7.5,['Netflix']
748,V per Vendetta,2006,"In un'Inghilterra scampata alla guerra nucleare e oppressa da una dittatura poliziesca, una giovane donna, Evey viene salvata da un uomo dal volto coperto da una maschera. Il suo nome è V, vuole vendicarsi di coloro che l'hanno internato in un campo di concentramento e l'hanno sottoposto a crudeli esperimenti medici; inizia così la sua rivolta contro il potere, cercando di sollevare i suoi concittadini contro la tirannia. Scoperta la verità sul passato di V, Evey trova in sè stessa una nuova forza e diventa un'alleata nel piano dell'uomo per ristabilire la libertà.",8.0,"['Netflix', 'Timvision', 'Amazon Prime Video', 'Mediaset Play']"
749,28 giorni dopo,2002,"Inghilterra, oggi. Durante un blitz un gruppo di animalisti irrompe in un laboratorio dove alcuni scimpanzè vengono sottoposti alla visione forzata di immagini violente. Il ricercatore che studia le cavie avverte gli attivisti che gli animali sono affetti da un virus sconosciuto e pericoloso. Malgrado ciò, i membri del commando decidono di liberare gli animali, da cui vengono immediatamente attaccati. 28 giorni dopo, Jim si risveglia in una Londra deserta e spettrale. La città sembra deserta e Jim vaga alla ricerca di esseri umani. E' solo l'inizio di un'avventura dai risvolti terrificanti, dove l'uomo civilizzato si conferma come la belva peggiore.",7.3,['Disney Plus']
750,Hurray for Huckle: Zooming Around Busytown,2007,"Something strange seems to be going on with the vehicles in Busytown. Thanks to a mix-up at the gas station, the cars have started blowing bubbles, Lowly Worm can't find his apple car and somebody has been nibbling on the Mouse family's cheese car. Can Huckle Cat solve all these automotive mysteries? This exciting collection of fun-filled episodes is from the popular animated series based on the books by Richard Scarry.",,[]
751,Tom & Jerry,2021,"Il topo Jerry si trasferisce nel miglior hotel di New York alla vigilia del ""matrimonio del secolo"", costringendo il disperato organizzatore dell'evento ad assumere il gatto Tom per sbarazzarsi di lui. La conseguente battaglia tra gatto e topo minaccia di distruggere la sua carriera, il matrimonio e forse l'hotel stesso. Ma presto, sorge un problema ancora più grande: uno staff diabolicamente ambizioso che cospira contro tutti e tre.",6.1,['Netflix']
752,Jam Films 2,2004,Jam Films 2 features 4 short films by different Japanese directors.,5.7,[]
753,Manchester by the Sea,2016,"Lee Chandler conduce una vita solitaria in un seminterrato di Boston, tormentato dal suo tragico passato. Quando suo fratello Joe muore, è costretto a tornare nella cittadina d'origine, sulla costa, e scopre di essere stato nominato tutore del nipote Patrick, il figlio adolescente di Joe. Mentre cerca di capire cosa fare con lui, e si occupa delle pratiche per la sepoltura, rientra in contatto con l'ex moglie Randy e con la vecchia comunità da cui era fuggito. Allontanare il ricordo della tragedia diventa sempre più difficile.",7.7,"['Starz', 'Amazon Prime Video', 'Starz Play Amazon Channel']"
754,Principessa Mononoke,1997,"In seguito allo scontro con un animale posseduto da un demone il principe Ashitaka viene contaminato da una maledizione mortale. Si mette dunque in viaggio per scoprirne l'origine e chiedere una cura al grande Dio Bestia, l'unico in grado di guarirlo. Arrivato nelle regioni da cui proveniva la bestia scopre una guerra tra uomini e una forma primitiva di animali della foresta, giganti, senzienti e aiutati da quella che chiamano la Principessa Spettro, una ragazza cresciuta dai lupi che ha rinnegato gli uomini. Dall'altra parte gli uomini, capitanati da Lady Eboshi che gestisce con amore, giustizia e pietà il suo villaggio di fabbri, vogliono lavorare la montagna e abbattere gli alberi per poter estrarre il ferro (fonte di ricchezza). In mezzo un gruppo di monaci cerca di fomentare gli uomini ad uccidere il Dio Bestia e rubarne la testa perchè, si dice, fornisca l'eterna giovinezza.",8.4,['Netflix']
755,Il rito delle streghe,2020,"Quattro aspiranti giovani streghe riescono ad ottenere più di quanto desiderano grazie a poteri occulti con i quali, però, dovranno fare i conti.",5.4,['Netflix']
756,"tick, tick... BOOM!",2021,"Narra la storia di Jon, un musicista e compositore di teatro che da anni lavora come cameriere a New York, mentre scrive quello che spera sia il prossimo musical di successo di Broadway. Jon ha lavorato alla sua opera per anni e mancano pochi giorni alla presentazione ufficiale: è sottoposto a grandi pressioni da ogni parte, dalla sua fidanzata Susan, stanco di vederlo procrastinare, e dall'amico Michael, che ha abbandonato i suoi sogni per una sicurezza finanziaria e lo esorta a non fare lo stesso. Jon, intanto, vive tutto questo nel cuore della comunità artistica segnata dall'epidemia di AIDS...",7.6,['Netflix']
757,Simmasanam,2000,"Sakthivel (Vijayakanth) and Thangarasu (Vijayakanth) are stepbrothers and both are respected by the villagers. But Sakthivel refuses to even acknowledge Thangarasu as his brother since he believes that it was Thangarasu's mother who killed their father. Thangarasu too is under this impression until his grandfather (R.Sunderrajan) tells him the truth. Their father (Vijayakanth), whose first wife (Ambika) was a sharp-tongued woman, married Kannamma (Viji) when she earned a bad name. Thangarasu, who is now convinced that his mother was a good woman, sets out to find the truth.",6.0,[]
758,In Search of the Pantanal,2001,"In Search of the Pantanal is an adventure/nature documentary, which follows an expedition across the world's largest wetlands, Brazil's Pantanal. Famous for its varied birds and wildlife, the Pantanal is a fascinating place, full of natural beauty and thriving ecosystem. The expedition is led by James Lynch, an entrepreneur who has organized several expeditions throughout Brazil over the years. This documentary gives the viewer a rich mosaic of the region, from its exotic wildlife to the fascinating people who live in this unique land. In Search of the Pantanal provides its audience with excitement and adventure, as they discover the hidden world of the Pantanal.",,[]
759,Crossover,2006,"The clock strikes midnight, money changes hands, the crowd is on their feet, and the court is alive with fast-paced razzle-dazzle basketball. These players don't play for a school or a pro team. They play for the street and it's underground...way underground.",2.9,[]
760,Crash - Contatto fisico,2005,"Una casalinga di Brentwood e il marito procuratore. Un iraniano proprietario di un 24hours shop. Due detective della polizia, amanti occasionali. Il direttore nero di un canale televisivo e la moglie. Un fabbro latinoamericano. Due ladri di automobili. Una recluta della polizia. Una coppia coreana di mezza età... Vivono tutti a Los Angeles. E nelle prossime 36 ore per loro sarà inevitabile scontrarsi...",7.5,[]
761,Cyrano,2021,"Troppo impacciato per corteggiare la bella Roxane, il paroliere Cyrano de Bergerac aiuta il giovane Christianin a conquistare il cuore della ragazza grazie a splendide lettere d'amore scritte da lui.",6.3,['Amazon Prime Video']
762,Through His Eyes,2012,"Through his eyes follows the story of Ryan throughout various stages of his life and tells the story of how he ended up where he is today, a homeless drug addict. Ryan had all the potential in the world but one wrong choice changed the path of his future.",,[]
763,Lo sciacallo,2014,"Louis è un ladro di materiali edili quando lo incontriamo, non è chiaro cosa abbia fatto prima ma ora ruba rame, ferro e simili per rivenderli sottoprezzo ai cantieri con un obiettivo più grande: trovare un vero lavoro in una congiuntura economica non facile. Tuttavia nessuno assume un ladro. Un giorno è testimone di un incidente stradale e vede una troupe televisiva accorsa per riprendere l'accaduto, capisce che è un vero lavoro e uno che paga ma nemmeno in questo caso trova qualcuno pronto ad assumerlo così pensa di poter fare da sè e con i propri metodi (il furto) ruba il necessario per comprare un'attrezzatura di base e iniziare a girare le strade di Los Angeles in cerca di incidenti, furti e cronaca dura da rivendere ad un'emittente locale con pochi scrupoli. Quando il business si fa più serio aumenta anche la sua abilità ma non il suo senso del limite e dell'etica verso le vittime.",7.7,"['Sky Go', 'Now TV']"
764,Swan Song,2009,Short gay melodrama.,2.0,[]
765,Jazz Icons: Lionel Hampton Live in '58,2008,"Lionel Hampton takes the stage in Belgium in this concert film from 1958 that showcases the multitalented jazz musician's dazzling skills on drums, piano, vibes, vocals -- and even dancing. Backed by a stellar orchestra that includes soloists Andy McGhee, Billy Mackel and Lou Blackburn, Hampton wows his Belgian audience with ""Brussels Sprouts,"" ""The High and the Mighty,"" ""Hot Club Blues,"" ""The Chase,"" ""Hamp's Piano Blues"" and more.",9.0,[]
766,Clerks - Commessi,1994,"La pellicola racconta le vicende di una intera giornata di un commesso di alimentari nella periferia americana, Dante Hicks, costretto a recarsi al lavoro nel suo giorno di riposo. Tra dialoghi contorti e surreali, scenette divertenti e grottesche (memorabile la polemica sulla posizione politica dei subappaltatori che stavano costruendo la seconda Morte Nera di Guerre stellari e la scena del signore anziano che chiede di utilizzare il bagno), la giornata di Dante passa di guaio in guaio, peggiorando sempre più. Insieme a Dante ci sarà a fargli compagnia Randal, il ragazzo che lavora al videonoleggio accanto all'alimentari, perennemente in pausa.",7.6,[]
767,Submerged,2000,Navy SEALs launch a rescue mission after terrorists plunge a jet carrying a missile-launching computer into the sea.,3.5,[]
768,Summer's End,2000,"12-year-old boy and his older brother have just lost their dad. At their summer cottage, the younger boy befriends a black doctor who has to deal with local prejudice and racism.",7.0,[]
769,Superguy: Behind the Cape,2000,"This independent, low budget mockumentary chronicles the life and times of a real life super hero.",5.5,[]
